Date Posted,URL,Region,Message,Status,Resolved Date,Departement,Action
16 Mar 2020,https://laporgub.jatengprov.go.id/detail/LGWP95340398.html,KOTA MAGELANG,"Yth. Bp Ganjar Pranowo, Assalamualaikum pak.. Kami warga magelang kota dan kabupaten mohon dibantu pengadaan masker, antiseptik/ hand sanitizer atau alcohol 70% untuk membuat hand sanitizer sendiri karena kami sudah mencari diapotik dan toko obat semuanya kosong.. Sampai kami mencari dikota solo dan juga wonogiri di tempat orang tua saya tinggal jg semuanya kosong pak.. Mohon bantuannya pak kita bisa membeli melalui pemerintah karena kalau lewat toko online terus terang harganya tidak terjangkau pak... Hanya ini yg dpt kami sampaikan pak atas perhatian bapak untuk rakyat jawa tengah kami ucapkan terimakasih, semoga bapak dan keluarga selalu diberikan kesehatan dan keberkahan dari Allah SWT.. Amin.",Selesai,"Selasa, 02 Juni 2020 - 22:59 WIB",Kota Magelang,Laporan Selesai
20 Mar 2020,https://laporgub.jatengprov.go.id/detail/LGAN07032851.html,KOTA MAGELANG,slmat pagi pak/ibu...saya sigit warga kota magelang mau minta tolong kepada bapak ganjar dan tim tolong merazia masker dan hand sanitizer di daerah kota dan kab mgl pak soalnya disini masker dan hand sany sulit tp di jual beli online banyak yg jual dgn harga selangit...mgkin klu yg mampu bisa beli tp banyak temen2 saya yg kurang mampu mengeluh dgn harga jualnya...sudi kiranya ada sidak atau razia supaya ketersediaan masker dan hand sany mencukupi...trimakasih sebelumnya dan maaf klu mengganggu waktu bapak/ibu...trimakasih atas tanggapan dan respon dr bapak/ibu sekalian,Selesai,"Rabu, 03 Juni 2020 - 06:59 WIB",Kota Magelang,Laporan Selesai
21 Mar 2020,https://laporgub.jatengprov.go.id/detail/LGWP78063698.html,KOTA MAGELANG,"Saya lakukan deteksi mandiri covid 19 Jateng, hasilnya diminta periksakan ke RS. Saya langsung ke RSU Tidar Magelang. Yg saya rasakan, keselamatan petugas kesehatan amat diutamakan, tapi pasien tidak. Pasien masuk ruang tunggu, duduk di ruang tunggu, tidur di tempat tidur pemeriksaan secara bergantian tanpa adanya proses sterilisasi di tempat tersebut. Jika pasien sebelumnya suspect, kemudian dia meninggalkan virus di ranjang pemeriksaan, dan ranjang tersebut dipakai orang lain yg sebenarnya sehat tapi cemas dan ikut periksa, maka yg sehat tersebut akan tertular oleh pasien sebelumnya. Mohon ini dibenahi, Bapak.",Selesai,"Selasa, 14 April 2020 - 19:12 WIB",Kota Magelang,Laporan Selesai
22 Mar 2020,https://laporgub.jatengprov.go.id/detail/LGWP15524207.html,KOTA MAGELANG,"sekolah saya pak wong siswanya aja dilarang masuk sekolah eh malah gedungnya disewakan untuk pernikahan kan ngak logis pak, katanya siswanya ngak diperbolehkan masuk karena mencegah corona malah gedung disewakan untuk pernikahan kan malah banyak tamunya to pak",Selesai,"Selasa, 02 Juni 2020 - 23:00 WIB",Kota Magelang,Laporan Selesai
24 Mar 2020,https://laporgub.jatengprov.go.id/detail/LGWA05501585.html,KOTA MAGELANG,"Mohon bantuan untuk penyemprotan cairan disinfektan dan pemeriksaan kesehatan guna pencegahan dan penyebaran virus Corona di rusunawa tidar Utara kecamatan Magelang Selatan,kota Magelang..",Selesai,"Rabu, 03 Juni 2020 - 07:01 WIB",Kota Magelang,Laporan Selesai
25 Mar 2020,https://laporgub.jatengprov.go.id/detail/LGWP83948254.html,KOTA MAGELANG,"Selamat siang pak Gub.. Istri saya bertugas di Puskesmas Secang 1 Kab. Magelang, hari ini direncanakan screening santri yang datang dari Sulawesi, kurang lebih 150 orang. Bersyukur koordinasi tingkat Kab, Bupati+Kadinkes, Forpim tingkat kecamatan baik. Mhn dukungan doa semua lancar, semua sehat. Matur nuwun..",Selesai,"Selasa, 31 Maret 2020 - 13:55 WIB",DINAS KESEHATAN,Terkait dengan aduan virus corona mohon untuk menghubungi hotline COVID-19 Jawa Tengah yang saat ini sudah dapat diakses melalui telepon di 0243580713 dan WA Chat 082313600560. Untuk mengetahui perkembangan COVID19 di wilayah Jateng silahkan akses website https://corona.jatengprov.go.id Terimakasih
26 Mar 2020,https://laporgub.jatengprov.go.id/detail/LGWP27913261.html,KOTA MAGELANG,"mohon izin saya mau konformasi apakah benar ada positif corona virus, an : Damar Sapda Panjal tgl lahir: 8 januari 1997 magelang utara alamat : serayu timur, kedung sari dengan keterangan meninggal di RST diagnosa radang paru kronologi saya lihat di artike harian di http:\\magelangnews.com dengan judul Mahasiswa PDP covid19 di magelang ternyata meninggal bukan karena Corona! senin 23 maret 2020 oleh Farizka Imelda sedangkan, menurut harian http://borobudurnews.com dengan Judul Mahasiswa magelang yang meninggal di RST dinyatakan positif corona tgl 26 maret 2020 oleh Bnews3 berhubung calon istri saya orang yang tinggal di wilayah tersebut, kami butuh konfirmasi segera informasi yang transparan, langkah nyata dari pemerintah kota magelang harus dibuktikan karena jika tidak transparan akan membahayakan warga setempat, kami memohon agar segera dilakukan pemantauan terkait kondisi diatas, agar segeradiinfokan ke kelurahan, RT/RW setempat sebagai tindakan preventif dari pemkot dan dinkes kota magelang bahkan sampai provinsi jawa tengah . kami mohon dengan sangat warga perlu berita yang actual dan jelas agar virus covid19 tersebut tidak menyebar di kedungsari magelang utara. mohon untuk dikonfirmasi kembali ke saya agar berita dari harian online tersebut nyata dan benar dan tidak hoax demikian kami sampaikan laporan ini, mohon kerjasama dan kami ucapkan terimakasih putramrifqi@gmail.com",Selesai,"Selasa, 02 Juni 2020 - 23:00 WIB",Kota Magelang,Laporan Selesai
27 Mar 2020,https://laporgub.jatengprov.go.id/detail/LGWP80517608.html,KOTA MAGELANG,"Saya seorang dosen di Universitas Muhammadiyah Magelang, saya prihatin dengan kondisi situasi saat ini di Magelang dan kota lainnya yang mengharuskan orang bekerja dan belajar dari rumah. Yang menjadi pemikiran saya adalah saat ini yang banyak dibutuhkan sebagian banyak orang agar bisa bekerja dan sekolah dari rumah adalah akses INTERNET karena ini satu-satunya yang bisa diandalkan dalam beraktivitas dalam kondisi seperti ini. Tapi kenapa dalam kondisi saat ini belum saya dengar kebijakan dari pemerintah , Telkom atau provider internet untuk memberi ""kebebasan"" paling tidak kemudahan dan keringanan biaya internet di daerah yang rawan seperti Magelang dan sekitarnya. Kami sebagai dosen dan guru harus tetap memberikan pembelajaran kepada mahasiswa dan siswa tentunya kami mengandalkan internet sebagai media pembelajaran yang memungkinkan. Ketika diterapkan berbagai metode belajar online mulailah muncul permasalahan baik dari sisi pengajar maupun peserta didik, masalah utama ada pada keterbatasan akses internet. Tidak semua pengguna online memiliki internet yang layak dirumah bahkan ada yang sama sekali tidak memiliki akses. Masalah lain adalah biaya internet yang menurut saya masih relatif mahal bagi kalangan siswa atau mahasiswa. Menurut saya Ini adalah masalah yang penting dan perlu segera dicarikan solusi demi nasib pendidikan bangsa ini. Kalau boleh usul, saya mencoba ilustrasikan titik pelanggan Telkom Indihome sudah hampir menyebar wilayah kota dan kabupaten, tentunya kalau Telkom mau membuat pancaran free wifi yang merata saya rasa tidak sulit, apalagi ada kolaborasi beberapa provider lainnya. Demikian, saya tunggu kepedulian pemerintah dan Telkom jangan malah sibuk mengisolir internet yang telat bayar please.. Salam damai #dirumahaja",Selesai,"Rabu, 03 Juni 2020 - 06:55 WIB",Kota Magelang,Laporan Selesai
28 Mar 2020,https://laporgub.jatengprov.go.id/detail/LGAN54697634.html,KOTA MAGELANG,RSI Magelang Kota perlu bantuan sperti pada gambar. Untuk Kelurahan mohon di himbau lebih keras lagi terkait Covid-19 karena masih banyak yang cuek.,Selesai,"Selasa, 02 Juni 2020 - 23:01 WIB",Kota Magelang,Laporan Selesai
28 Mar 2020,https://laporgub.jatengprov.go.id/detail/LGWA80116243.html,KOTA MAGELANG,"Selamat siang Pak, sy seorang ibu rmh tangga dan suami saat ini sedang sakit asam urat akut dan bermasalah pd ginjalny, sy mempunyai 5 ank yg hrs saya hidupi , sy tinggal di jln mahakam 3 rt3 rw8 no 41 kedungsari mgl. Dg adny musibah corona sy tdk bs bekerja krn tdk bs menitipkan mknan di sekolah2 krn Dili burkan, sy bingung krn akhir bln ini hrs byr hutang ke orang krn dia jg butuh sdg unt sehari hari km saat ini kesulitan. Sedang di kampung tdk dot bantuan krn ktp saya ambarawa sdg tinggal di magelang .besar harapan km bpk berkenan mendengarkan keluhan rakyat kecil seoerti km.trimakasih Bpk",Selesai,"Selasa, 14 April 2020 - 17:18 WIB",Kota Magelang,Laporan selesai
01 Apr 2020,https://laporgub.jatengprov.go.id/detail/LGAN53433506.html,KOTA MAGELANG,"pelayanan rumah sakit dan fasilitas mhn diberikan perhatian pak. fasilitas bagus, pelayanan bagus, membuat pengunjung dan pasien nyaman. setelah berdoa, salah satu faktor ikhtiar untuk mempercepat kesembuhan adalah faktor psikologis..diharapkan pengunjung gembira dan pasien gembira... lanjut terus pak ganjar, semangat pak.. ðŸ’ªðŸ’ª",Selesai,"Kamis, 02 April 2020 - 10:27 WIB",DINAS KESEHATAN,Terkait dengan aduan virus corona mohon untuk menghubungi hotline COVID-19 Jawa Tengah yang saat ini sudah dapat diakses melalui telepon di 0243580713 dan WA Chat 082313600560. Untuk mengetahui perkembangan COVID19 di wilayah Jateng silahkan akses website https://corona.jatengprov.go.id Terimakasih
31 Mar 2020,https://laporgub.jatengprov.go.id/detail/LGWP15680609.html,KOTA MAGELANG,"Pak ganjar tolong rsjs magelang kekurangan stok apd, krn dari kemenkesh prosesnya lama, sementara pdp nya lumayan banyak. Mngkn di provinsi ada stok pak ganjar pranowo. Kasihan pegawai rsjs yg menangani covid 19, resah krn apd, walaupun bukan rs provinsi tp yg dilayani masyarakat jateng juga. Terimakasih sebelumnya",Selesai,"Jumat, 03 April 2020 - 11:22 WIB",DINAS KESEHATAN,Terkait dengan aduan virus corona mohon untuk menghubungi hotline COVID-19 Jawa Tengah yang saat ini sudah dapat diakses melalui telepon di 0243580713 dan WA Chat 082313600560. Untuk mengetahui perkembangan COVID19 di wilayah Jateng silahkan akses website https://corona.jatengprov.go.id untuk wilayah magelang silahkan akses di covid19.magelangkota.go.id Terimakasih
07 Apr 2020,https://laporgub.jatengprov.go.id/detail/LGWP49049864.html,KOTA MAGELANG,"Malam, pak Ganjar. Saya mau curhat. Kemaren saya daftar keringanan kredit di leasing motor FIFgroup. Sudah mendapat balasan, bahwasanya yang mendapat keringanan kredit adalah debitur konvensional, sedangkan saya adalah debitur syariah. Mohon pak Ganjar bisa minta tolong di tanyakan ke OJK, informasi tersebut apakah benar? Karena di website FIF tidak jelas. Padahal setahu saya hampir semua yang kredit motor di honda tunas jaya magelang member FIFastra masuknya ke debitur syariah. Bagaimana jika ada driver ojek online yang kredit di FIF (debitur syariah), mereka tidak dapat keringanan kredit. Kasihan. Padahal driver ojek online menjadi prioritas utama arahan pak Presiden lewat OJK. Sebagai informasi, saya memang bukan driver ojek online, namun saya bekerja di salah satu hotel semarang, yang terdampak pemotongan gaji (unpaid leave) dan bergantian dirumahkan imbas dari menurunnya tingkat hunian hotel. Pemotongan gaji lebih 50%, hanya cukup untuk beli kebutuhan pokok keluarga. Saya cuma minta keringanan penundaan pembayaran beberapa bulan kedepan saja, semoga dunia pariwisata lekas membaik.",Selesai,"Kamis, 18 Februari 2021 - 08:45 WIB",BIRO PEREKONOMIAN,"Terima kasih, mohon maaf untuk seluruh Perusahaan Perbankan, Perusahaan Lembaga Keuangan dan Perusahaan Leasing yang terdaftar resmi di OJK menjalankan aturan dan mekanisme yang telah ditetapkan sesuai aturan internal sesuai dengan kesepakan bersama dengan pihak  nasabah  dan Peraturan Perundang-undangan yang berlaku. Komunikasikan dengan Pihak yang terkait dengan saudara dan megikuti aturan ketentuan yang telah ditetapkan. Kalau masih kurang jelas silahkan menghubungi lewat WA / SMS ke Kredit Center nomor telp : 081325163300 / 087834777466, atau langsung masuk link : https://kreditcenter.jatengprov.go.id."
08 Apr 2020,https://laporgub.jatengprov.go.id/detail/LGWP79910408.html,KOTA MAGELANG,"Pak Ganjar, nomor WhatsApp untuk pengaduan OJK Pusat tidak di respon. Apakah harus di telp?",Selesai,"Senin, 25 Januari 2021 - 09:17 WIB",BIRO PEREKONOMIAN,"Terima kasih, mohon maaf untuk seluruh Perusahaan Perbankan, Perusahaan Lembaga Keuangan dan Perusahaan Leasing yang terdaftar resmi di OJK menjalankan aturan dan mekanisme yang telah ditetapkan sesuai aturan internal sesuai dengan kesepakan bersama dengan pihak  nasabah  dan Peraturan Perundang-undangan yang berlaku. Komunikasikan dengan Pihak yang terkait dengan saudara dan megikuti aturan ketentuan yang telah ditetapkan. Kalau masih kurang jelas silahkan menghubungi lewat WA / SMS ke Kredit Center nomor telp : 081325163300 / 087834777466, atau langsung masuk link : https://kreditcenter.jatengprov.go.id."
11 Apr 2020,https://laporgub.jatengprov.go.id/detail/LGWP45298605.html,KOTA MAGELANG,"assallamualaikum pak gub....sya mau pnjelasan soal penangguhan kredit kendaraan, krn sya tdk bisa dpt penangguhan angsuran pdhl sya terkena dampak covid 19",Selesai,"Senin, 25 Januari 2021 - 08:39 WIB",BIRO PEREKONOMIAN,"Terima kasih, mohon maaf untuk seluruh Perusahaan Perbankan, Perusahaan Lembaga Keuangan dan Perusahaan Leasing yang terdaftar resmi di OJK menjalankan aturan dan mekanisme yang telah ditetapkan sesuai aturan internal sesuai dengan kesepakan bersama dengan pihak  nasabah  dan Peraturan Perundang-undangan yang berlaku. Komunikasikan dengan Pihak yang terkait dengan saudara dan megikuti aturan ketentuan yang telah ditetapkan. Kalau masih kurang jelas silahkan menghubungi lewat WA / SMS ke Kredit Center nomor telp : 081325163300 / 087834777466, atau langsung masuk link : https://kreditcenter.jatengprov.go.id."
12 Apr 2020,https://laporgub.jatengprov.go.id/detail/LGWP27952001.html,KOTA MAGELANG,Saya sebagai pendaftar lowongan petugas kebersihan di BRT trans jateng rute mgl purworjo pak...sy tdk lolos seleksi pdhl berkas lengkap pengalaman krj sbg ob jg ada...tdk ada pertimbangan dr sna bgaimana susahny mencari pkerjaan..aplg sy sudah berkeluarga...yg diprioritaskan knp yg msh lajang ...trimakasih ...,Selesai,"Selasa, 14 April 2020 - 21:29 WIB",DINAS PERHUBUNGAN,Untuk kriteria penerimaan calon pegawai BRT Trans Jateng Magelang-Purworejo Monggo bisa ditanyakan lgs ke LPT Semarang di www.lptsemarang.com suwun
12 Apr 2020,https://laporgub.jatengprov.go.id/detail/LGAN81723423.html,KOTA MAGELANG,"pak, saya kemarin yg ikut seleksi petugas kebersihan BRT Trans Jateng rute magelang purworejo. Saya ingin tau, kenapa rakyat kecil seperti saya tidak di terima pak? Padahal saya benar benar membutuhkan pekerjaan seperti itu. Saya dari dulu ingin sekali bekerja membantu pemerintah melayani masyarakat, tetapi kenapa rakyat kecil seperti saya tidak bisa di terima. Padahal berkas berkas sudah lengkap pak. Saya minta tolong pak, agar saya bisa di beri kesempatan untuk bekerja di BRT Trans Jateng rute magelang purworejo... Terimakasih..",Selesai,"Selasa, 14 April 2020 - 21:29 WIB",DINAS PERHUBUNGAN,Untuk kriteria penerimaan calon pegawai BRT Trans Jateng Magelang-Purworejo Monggo bisa ditanyakan lgs ke LPT Semarang di www.lptsemarang.com suwun
14 Apr 2020,https://laporgub.jatengprov.go.id/detail/LGWP41797865.html,KOTA MAGELANG,"BPJS tenaga kerjaan , kapan mulai buka lagi pak, soalnya pakai aplikasi antrian banyak dan lama ""loding lama"", kami yang di PHK atau blm ada pemasukan dampak dr Corona, dan tidak dpt bantuan,, mohon bantuannya..",Selesai,"Selasa, 14 April 2020 - 18:45 WIB",BPJS Ketenagakerjaan Kanwil Jateng dan DIY,"Menanggapi keluhan yang disampaikan melalui lapor gubernur, perkenankan kami menyampaikan terima kasih atas kepercayaan yang telah diberikan kepada BPJS Ketenagakerjaan. Dapat kami informasikan bahwa untuk menekan penyebaran Corona Virus Disease 2019 (COVID-19) dan mendukung kebijakan pemerintah dengan mengurangi kontak antar individu, BPJS Ketenagakerjaan mengaktifkan protokol LAPAK ASIK (Layanan Tanpa Kontak Fisik) di seluruh Kantor Cabang maupun Kantor Cabang Perintis (KCP) sehingga diharapkan Peserta tetap dapat terlayani dengan baik tanpa harus meninggalkan rumah dan meniadakan operasional fisik hingga waktu yang belum ditentukan. Protokol LAPAK ASIK merupakan layanan online via website yang dapat di akses melalui alamat www.antrian.bpjsketenagakerjaan.go.id dan aplikasi BPJSTKU sehingga Peserta dapat memilih Wilayah dan Kantor Cabang Layanan untuk mengajukan klaim. Kami juga menyiapkan berbagai kanal informasi yang dapat diakses antara lain Layanan Masyarakat 175, situs www.bpjsketenagakerjaan.go.id, Twitter @bpjstkinfo, atau Facebook BPJS Ketenagakerjaan. Demikian kami sampaikan, terimakasih atas perhatiannya."
18 Apr 2020,https://laporgub.jatengprov.go.id/detail/LGWP52864328.html,KOTA MAGELANG,"asalamualaikum. kepada bapak gubernur yang terhormat.. saya mewakili pekerja seni bahwa kami mengeluhkan kebijakan yang telah di kluarkan terkait covid19... kenapa bantuan hanya di tujukan kepada pelayan,ojol dll. tapi kami selaku seniman dan seniwati tidak sama sekali. padahal banyak yang dari kami yang menggantungkan hidup kepada pekrjaan seni itu.. bagai mana nasib kami jika kami tidak ada bantuan dari pemerntah.. kami mohon bantuany dan kebijakany kepada bapak gubernur.",Selesai,"Rabu, 03 Juni 2020 - 06:56 WIB",Kota Magelang,Laporan Selesai
19 Apr 2020,https://laporgub.jatengprov.go.id/detail/LGWP60125168.html,KOTA MAGELANG,"Pak saya warga kota magelang siang ini saya barusan ditilang dengan alasan yg tidak jelas, saya dimintai uang oknum poltas pasar borobudur kab.magelang 100 ribu, jujur pak saya hanya seorang temaga harian pungutan itu membebani, mohon untuk didengar pak saya menyayangkan sekali oknum polisi itu.",Selesai,"Kamis, 23 Juli 2020 - 13:34 WIB",Kepolisian Daerah Jawa Tengah,file
19 Apr 2020,https://laporgub.jatengprov.go.id/detail/LGWP58032080.html,KOTA MAGELANG,"Ngentak kwayuhan RT/RW:07/02, MOHON BANTUAN KIP UNTUK ANAK SAYA YG MASIH SEKOLAH DIREALISASI PAK, KARNA SY SESEKALI PUN BELUM PERNAH MENDAPATKAN BANTUAN DARI PEMERINTAH, SY SERING PENGAJUAN TETAPI TIDAK ADA JAWABAN SAMA SEKALI",Selesai,"Selasa, 05 Mei 2020 - 12:49 WIB",DINAS PENDIDIKAN DAN KEBUDAYAAN,Monggo dilaporkan ke https://indonesiapintar.kemdikbud.go.id atau https://ult.kemdikbud.go.id
24 Apr 2020,https://laporgub.jatengprov.go.id/detail/LGWP01979631.html,KOTA MAGELANG,Sebelumnya mohon maaf Pak. Saya mau tanya setelah ada pandemi corona ini banyak PHK. Termasuk saya. Sedangkan saya ada tanggungan angsuran di koperasi.Apakah dari pemerintah daerah ga bisa kasih surat edaran pada koperasi untuk kasih penangguhan angsuran selama pandemi ini seperti yang di lakukan bank BRI karena di jaman pandemi ini untuk cari kerja juga sulit. Mohon respon nya Pak biar rakyat kecil seperti kami bisa bertahan hidup dalam keadaan seperti ini.,Selesai,"Rabu, 23 Desember 2020 - 14:24 WIB",BIRO PEREKONOMIAN,"Terima kasih, mohon maaf untuk seluruh Perusahaan Perbankan, Perusahaan Lembaga Keuangan dan Perusahaan Leasing yang terdaftar resmi di OJK dapat memberikan keringanan tetapi mereka menjalankan aturan dan mekanisme yang telah ditetapkan sesuai surat Edaran OJK dan Peraturan Perundang-undangan yang berlaku. Komunikasikan dengan Pihak yang terkait dengan saudara dan megikuti aturan ketentuan yang telah ditetapkan. Kalau masih kurang jelas silahkan menghubungi lewat WA / SMS ke Kredit Center nomor telp : 081325163300 / 087834777466"
24 Apr 2020,https://laporgub.jatengprov.go.id/detail/LGIG51567282.html,KOTA MAGELANG,"Asalamualiakum pak @ganjar_pranowo mau tanya pak masalah bantuan yg dr pemerintah apakah sudah ter realisasi?karna di lingkungan tmpt saya tinggal tepatnya di daerah kota magelang smpe skr blm ada info terkait bantuan tsb pak ???? saya sangat mengharapkan bantuan tsb karna saya slh satu warga yg terkena dampak covid19 dan berdampak saya harus kehilngan pekerjaan pak..saya bingung mau berbuat apa lagi karna saya menafkahi anak istri dan rumah jg masih ngontrak pak..mohon di baca pesan saya ini pak,trmksh sblmnya wassalam",Selesai,"Selasa, 02 Juni 2020 - 23:01 WIB",Kota Magelang,Laporan Selesai
26 Apr 2020,https://laporgub.jatengprov.go.id/detail/LGWP92715703.html,KOTA MAGELANG,"saya cuma mau usul aja pak selama 26 tahun istri saya jualan tapi nga pernah dapat bantuan dana tambahan modal, saya sering dengar tapi kok yang di bantu malh yang nga jualan, cuma akal""an aja di tinjau jualan padahal nga, sampai detik.ini blm pernah dapat bantuan tambahan modal cuma pingin grobak istri saya, mksh dan mohon pertmbangannya mksh, dan kalau mau datang ke gubug saya boleh pak, gubuk saya persis kandang dan rumah yang belakng roboh, udah hampir 3 thn, kemarin ada dataan kok yang di data malah rumahnya lebih baik dari tmpt saya, persisnya sepupu saya, untk alamat dan nomer rumah sama mksh",Selesai,"Rabu, 06 Mei 2020 - 11:21 WIB",DINAS KOPERASI DAN UMKM,Terimakasih atas curhatannya pak. Kami informasikan bahwa tahun ini tidak ada anggaran bantuan modal. Jika membutuhkan tambahan modal. Bapak bisa mengajukan KUR di Bank bank terdekat.
27 Apr 2020,https://laporgub.jatengprov.go.id/detail/LGWP38960045.html,KOTA MAGELANG,"Bpk gubernur yg terhormat,,saya mau berkeluh kesah,, pekerjaan saya driver gojek,,dari dulu sampai sekarang belum pernah dapat bantuan dalam bentuk apapun,,entah itu BLT,,PKH,, padahal saya mempunyai 2 anak,, setiap hari g mesti dapat orderan , padahal makan tiap hari..minta tolong kebijakan nya pak.. terimakasih",Belum Diproses,Belum Diproses,Belum Diproses,Belum Diproses
27 Apr 2020,https://laporgub.jatengprov.go.id/detail/LGAN57615108.html,KOTA MAGELANG,pak gmn caranya mendapatkan bantuan sosial efek dari covid 19?sedangkan saya cm driver gojek ..mohon bimbingannya,Belum Diproses,Belum Diproses,Belum Diproses,Belum Diproses
27 Apr 2020,https://laporgub.jatengprov.go.id/detail/LGAN48741035.html,KOTA MAGELANG,"assalamualaikum,, Sugeng ndalu pak Ganjar,,coronipun Ben saget angsal bantuan amargi dampak saking covid19 pripun?Kulo driver gojek kengeng dampak Corona niku secara langsung,,nderek solusinipun.. matursuwun",Belum Diproses,Belum Diproses,Belum Diproses,Belum Diproses
29 Apr 2020,https://laporgub.jatengprov.go.id/detail/LGWP20674852.html,KOTA MAGELANG,Selamat pagi Bapak Ganjar yang terhormat semoga selalu diberi kesehatan dan dijauhkan dari segala penyakit beserta keluarga bapak. Melalui ini saya hanya ingin bertanya. Apakah dalam situasi seperti ini adakah penangguhan tentang pajak kendaraan ? Apabila ada selama berapa lama penangguhan pajak itu berlaku agar tidak dikenakan denda pak. Terimakasih..,Selesai,"Jumat, 08 Mei 2020 - 10:58 WIB",BADAN PENGELOLA PENDAPATAN DAERAH,Bebas Biaya Denda Pajak Kendaraan Bermotor sudah berlaku mulai
29 Apr 2020,https://laporgub.jatengprov.go.id/detail/LGWP52534299.html,KOTA MAGELANG,"di lingkungan saya/RT,,pendaftaran wrga yg dpt bantuan pandemi covid19,saya rasa kurang tepat sasaran,,ada wrg, suaminya saja yg krja,dan sdh di rumahkan,anak 5 msh kecilÂ²,rmh ikut orang tua,tp dia TIDAK terdaftar penerima bantuan,dan jg ada wrga lain yg seharusnya dpt bantuan,,tp,malahan wrg lain yg ekonominya mapan& mampu+fasilitas tercukupi,mlah mereka sllu dapat bantuan,termasuk bantuan PKH dll..mohon di pantau penyaluran bantuan spya tepat sasaran..di lingkungan saya hanya merekaÂ² yg dekat dengan penguasa yg sllu di prioritaskan dpt bantuan.",Belum Diproses,Belum Diproses,Belum Diproses,Belum Diproses
01 May 2020,https://laporgub.jatengprov.go.id/detail/LGWP14141720.html,KOTA MAGELANG,Pak Ganjar.saya minta solusi agar pencairan dana bpjs ketenagakerjaan lebih mudah.soalnya saat ini sistem pencairannya lewat online dan untuk mendaftar nomor antrian online selalu penuh sudah saya coba berkali kali disemua cabang seindonesia.Pak dana itu kita sangat butuhkan ditengah situasi saat ini..mohon solusinya pak..,Selesai,"Minggu, 10 Mei 2020 - 10:47 WIB",BPJS Ketenagakerjaan Kanwil Jateng dan DIY,"Menanggapi keluhan yang disampaikan oleh Bapak Zulkarnain terkait antrian online BPJS Ketenagakerjaan, dapat kami informasikan bahwa penyebaran Covid-19 yang melanda berbagai negara di dunia termasuk Indonesia berdampak pada peningkatan jumlah tenaga kerja yang ter-PHK/dirumahkan akibat krisis sosial ekonomi. Setidaknya sebanyak 1,7 juta pekerja di Indonesia telah dirumahkan oleh perusahaan maupun terkena PHK. Sebagai salah satu upaya kami dalam menekan penyebaran Corona Virus Disease 2019 (COVID-19) dan mendukung kebijakan pemerintah dengan mengurangi kontak antar individu, BPJS Ketenagakerjaan mengaktifkan protokol LAPAK ASIK (Layanan Tanpa Kontak Fisik) di seluruh Kantor Cabang maupun Kantor Cabang Perintis (KCP) sehingga diharapkan Peserta tetap dapat terlayani dengan baik tanpa harus meninggalkan rumah dan meniadakan operasional fisik hingga waktu yang belum ditentukan. Protokol LAPAK ASIK merupakan layanan online sehingga Peserta dapat memilih Wilayah dan Kantor Cabang Layanan untuk mengajukan klaim. Kami juga menyiapkan berbagai kanal informasi yang dapat diakses antara lain Layanan Masyarakat 175, situs www.bpjsketenagakerjaan.go.id, Twitter @bpjstkinfo, atau Facebook BPJS Ketenagakerjaan. Jumlah antrian pada sistem antrian online telah disesuaikan dengan kemampuan dalam melayani peserta yang dihitung berdasarkan ketersediaan jumlah personil dan dibatasi oleh jam layanan. Pelayanan yang kami berikan sesuai dengan standar yang berlaku di BPJS Ketenagakerjaan. Kami mohon pengertian seluruh peserta yang mengakses layanan kami, untuk bersama-sama mendukung program pemerintah dalam mencegah meluasnya Covid-19 untuk kebaikan bersama. Demikian kami sampaikan, atas perhatiannya kami ucapkan terima kasih. BPJS Ketenagakerjaan selalu berkomitmen untuk memberikan pelayanan PRIMA kepada seluruh peserta."
