Date Posted,URL,Region,Message,Status,Resolved Date,Departement,Action
04 Mar 2021,https://laporgub.jatengprov.go.id/detail/LGWP52464206.html,KOTA PEKALONGAN,"Assalamualaikum pak gubernur, saya mau tanya pergub no 7 tahun 2020 tentang honorarium, di pasal 6 poin c bagi guru produktif pada satuan pendidikan SMK dengan kompetensi keahlian tertentu yg belum diluluskan oleh lptk maka linieritas dibuktikan dengan sertifikat keahlian, kebetulan saya ngajar di smk tekstil kota pekalongan yang ijazahnya pendidikan fisika dan sudah 7 tahun mengabdi di sini, pas ada pebdataan guru honorer saya tidak bisa masuk karena tidak linier soalnya dibutuhkan di sekolahan dan ngajarnya tekstil, berjalannya waktu ada program dari pemerintah memagangkan guru dan selesai mendapatkan sertifikat dan saya juga mengikuti sertifikat kompetensi asesor dari BNSP, apakah ini bisa dianggap linier ya pak gubernur mohon pencerahannya, soalnya saya skrg blm masuk seperti temen2 yang linier lainnya",Belum Diproses,Belum Diproses,Belum Diproses,Belum Diproses
05 Mar 2021,https://laporgub.jatengprov.go.id/detail/LGWP34830497.html,KOTA PEKALONGAN,"Assalamualaikum bapak, saya mau meminta maaf soal menanyakan tentang pergub no 7 tahun 2020, saya akan klarifikasi, saya sudah di kasih tau atasan dan dari dinas terkait bahwa akan di kawal sampai tahun ajaran baru berkaitan dengan sertifikat kompetensi yang saya punya.... Dan saya mohon maaf kepada semua pihak... Wasalamualaikum warohmatullahi wabarokatuh",Belum Diproses,Belum Diproses,Belum Diproses,Belum Diproses
10 Mar 2021,https://laporgub.jatengprov.go.id/detail/LGIG42499577.html,KOTA PEKALONGAN,Pak mohon ditinjau daerah Pekalongan sekitar sekranding pabean pasir sari bandengan banjir terus sudah 3 bulan ini tidak pernah surut gimana solusinya sekian terima kasih,Selesai,"Senin, 03 Mei 2021 - 10:16 WIB",Tidak ada keterangan,Tidak ada keterangan
22 Mar 2021,https://laporgub.jatengprov.go.id/detail/LGWP08243585.html,KOTA PEKALONGAN,"Kejadian tadi pagi jam 08.30 di jalan tol 362,6 km ada batu sebesar kepala bayi ditengah jalan sehingga membuat ban mobil lubang gambarðŸ‘‡",Selesai,"Kamis, 25 Maret 2021 - 08:54 WIB",Jalan tol bkn kewenangan pemkot tetapi badan pengelola jalan tol. Apabila ada pengaduan langsung ke traffic information center tol telp 14080. terima kasih,Tidak ada keterangan
31 Mar 2021,https://laporgub.jatengprov.go.id/detail/LGWP09117002.html,KOTA PEKALONGAN,"mohon agar dilakukan razia knalpot karena sudah sangat mengganggu...tidak siang tidak malam hampir setiap hari geber geber knalpot baik motor ataupun mobil di wilayah pekalongan khususnya pekalongan selatan, mohon agar segera bisa ditindaklanjuti",Selesai,"Kamis, 06 Mei 2021 - 09:38 WIB",Kepolisian Daerah Jawa Tengah,"Bahwa kegiatan patroli dan Razia telah dilakukan oleh Personil Polsek Pekalongan Selatan dan beberapa kali Ops gabungan Polres, Satlantas, Bag Ops terhadap pengendara motor berknalpot Brong di wil hukum Polres Pekalongan. sesuai srt kapolres Pekalongan no: R/297/IV/REN.4.2/2021  tgl 26-04-2021"
01 Apr 2021,https://laporgub.jatengprov.go.id/detail/LGWP50968214.html,KOTA PEKALONGAN,"Perkenalkan Kami Tim Laporan Warga LaporCovid-19 (www.laporcovid19.org) yang saat ini tengah membuka laporan aduan dari masyarakat melalui kanal bot kami di WhatsApp: wa.me/6281293149546 atau Telegram: t.me/laporcovid19bot. Melalui laporan yang masuk pada tanggal 1 April 2021, kami mendapati laporan dari warga mengenai kerumunan di Alun-Alun Kota Pekalongan. Berikut kami rangkum informasinya, Kegiatan : Kerumunan Lokasi : Alun-Alun Kota Pekalongan. Keputran, Kec. Pekalongan Tim., Kota Pekalongan, Jawa Tengah 51128 Geomaps : https://goo.gl/maps/YzeUTfci3FoGcVUQ8 Isi Laporan: “kerumunan massa di alun-alun kota Pekalongan - Jawa Tengah, tidak ada teguran atau tindakan petugas Dilaporkan bahwa terjadi kerumunan massa di lokasi tersebut dan tidak adanya Satpol PP yang bertugas/menindak saat kejadian tersebut. Kami berharap laporan ini dapat diteruskan ke Kota Pekalongan dan pemerintah/dinas terkait dapat menindaklanjuti laporan ini. Hal ini karena kegiatan berkerumun dan minim protokol kesehatan dapat membahayakan kesehatan dan keselamatan warga yang berada di lokasi tersebut. Terima kasih atas perhatian dan kerjasamanya. Tertanda, Tim Laporan Warga LaporCovid-19",Belum Diproses,Belum Diproses,Belum Diproses,Belum Diproses
06 Apr 2021,https://laporgub.jatengprov.go.id/detail/LGWP94699046.html,KOTA PEKALONGAN,Pembangunan Tower BTS tidak berijin .lokasi desa dororejo kecamatan doro kabupaten pekalongan ..dan sudah berdiri hampir 3 bulan. Ketinggian 45 meter...salah satu warga terdekat menolak pembangunan tower dan menolak konpensasi ..dari keterangan pihak dinas perijinan juga membenarkan belum ada ijin,Belum Diproses,Belum Diproses,Belum Diproses,Belum Diproses
06 Apr 2021,https://laporgub.jatengprov.go.id/detail/LGWP51969039.html,KOTA PEKALONGAN,Asalamualaikum bapak gubernur yang terhormat.saya mau bercerita sdikit .saya seorang pedagang batik kecil (izek ajar ajaran).sya dulu tinggal dijenggot rt. 2.rw.9.terus rumah peninggalan ortu istri saya diwaris .akhirnya sya dapat sdikit bagian uang.terus uangnya buat dp perumahan bumi coprayan indah karena gak bakalan cukup kalau buat beli rumah kontan.sementara saya tinggal di kajen diperumahan baity jananti sambiroto punya kakak saya biar hemat gak ngontrak.sambil nunggu akad kredit perumahan bumi copran indah saya tetep tinggal dikajen mulai tanggal 11 agustus 2019 sampai 7agustus 2021.sementaran anak saya keduanya sekolah tetep dijenggot.ternyata wabah datang sampai setahun semua rencana saya gagal.akad kredit perumahn ditunda bagi yang usaha.sampe akhirnya saya lapor pak gubernur.akhirnya bisa akad kredit dan sudah saya tempati sejak 9 agustus 2021.yang jadi masalah usaha macet karena pandemi punya hutang dmna mana.waktu ada bantuan corona sya pernah datang ke kelurahan jenggot untuk mengumpulkan kk dan ktp supaya dapat bantuan.karena sya tinggal dikjen jdi terlambat kata bapak lurah taibin datanya sudah dikirim kepusat.waktu itu sya masih pya tabungan.jdi sya gak mau ribet mungkin belum rejeki saya.sya gak pernah sama sekali dapat bantuan yang 200 lah.300.600.apalagi prakerja.apalgi umkm saya masih punya hutang kur dibri dan sudah nunggak 3kali angsuran.saya punya angsuran rumah dibank jateng sebulan 887.000selama 20tahun.dan bri 617.500 kurang 14buanan.dulu sebelum corona melanda penghasilan saya cukup utuk membayar semuaya.modal habis buat makan pas lockdown.sekarang kerja buruh harian lepas kadang dpat 100rb kadang 70 rb.buat nafkahi 3 anak saya dan istri saya.tolong pak kasih saya solusi yang terbaik .sya gak pernah dapat bantuan yang namanya corona.buat mkan sehari aja sya bisa pak.tapi pak buat setoran bank nya darimana pak.terimaksih pak gubernur yang terhormat,Selesai,"Jumat, 30 April 2021 - 10:03 WIB"," Bila belum pernah dapat bantuan bisa langsung datang ke Kantor Dinsos Kota Pekalongan di Jl. Sriwijaya No.40, Podosugih, Kec. Pekalongan Barat Kota Pekalongan Terma Kasih Laporan nya",Tidak ada keterangan
07 Apr 2021,https://laporgub.jatengprov.go.id/detail/LGWP32402563.html,KOTA PEKALONGAN,"Situs web pengaduan dan pengajuan SP2 SLRT Batik Kota Pekalongan kok gak beres, katanya bisa lewat situs untuk pengaduan/pengajuan, tapi kok cuma bisa diakses depannya saja. Saat konfirmasi untuk Ajukan jawabannya "" Your file couldn’t be accessed"" Gimana ini Pak Ganjar, soalnya untuk PKH di Kota Pekalongan pada tidak tepat sasaran. Mohon untuk ditindak lanjuti.",Selesai,"Rabu, 21 April 2021 - 09:13 WIB",jawaban dari Dinsos Situs web pengaduan dan pengajuan SP2 SLRT Batik Kota Pekalongan sudah bisa di akses apabila menghadapi kendala bisa ke konsultasi dgn fasilitator kelurahan terdekat atau juga bisa langsung ke Kantor Dinsos Kota Pekalongan Terima kasih,Tidak ada keterangan
15 Apr 2021,https://laporgub.jatengprov.go.id/detail/LGSM56943907.html,KOTA PEKALONGAN,"Selamat siang bpk,saya warga kota pekalongan menginformasikan bahwa di bantaran sungai yosorejo timur smkn 4 dan timur pasar pemotongan ayam sebagian longsor kena banjir hampir mengenai badan jalan mohon untuk tindak lanjuti,terima kasih.",Selesai,"Kamis, 22 April 2021 - 10:48 WIB",DINAS PEKERJAAN UMUM SUMBER DAYA AIR DAN PENATAAN RUANG,"Hasil cek lapangan kami sampaikan : 1. Lokasi dimaksud adalah tebing sebelah kiri S.Banger tepatnya di Ds.Kuripan Yosorejo, Kec. Pekalongan Selatan, Kota Pekalongan. 2. Dimensi longsoran panjang= 12 m, lebar= 3 m, tinggi= 5 m. 3. Longsoran mengancam jalan yg berada di timur SMKN 4 Kota Pekalongan. 4. Akan dilakukan penanganan darurat bersama Dinas PUSDATARU Prov.Jateng dan Balai PSDA Pemali Comal. Demikian terima kasih"
18 Apr 2021,https://laporgub.jatengprov.go.id/detail/LGIG04501084.html,KOTA PEKALONGAN,"Program ""Jogo tonggo"" apa masih berlaku???? Itulah pertanyaan saya sebagai seseorang yang pernah terkena covid 19 tanpa gejala, ketika saya, istri dan anak² isolasi diri di rumah selama 14 hari, tanpa keluar rumah disitu saya mempertanyakan program ""jogo tonggo"" Ini, tidak ada tetangga ataupun kerabat yg mendekat, semua nya seperti ""mengucilkan"" saya dan keluarga, bahkan tidak ada yg membantu bagaimana kami sekeluarga makan, apa memang di sini sudah tidak ada toleransi dan nurani sehingga tidak ada saling membantu, bahkan Ketua RT nya dan anak dari Ketua RT nya yang ""memprovokasi"" Warga nya untuk tidak mendekat bahkan terkesan mengucilkan kami, bahkan setelah 14 hari lewat, perlakuan itu tetap saja sama. Saya warga RT 02 RW 10 Kel. Medono Kec. Pekalongan Barat Kota PekalongaPekalongan @kotapekalongan @walikotapekalongan @ganjar_pranowo @laporgub.jtg",Selesai,"Selasa, 20 April 2021 - 10:59 WIB","Jawaban dari Dinkes Pekalongan; Turut Prihatin, semoga kedepan lebih baik dan tidak ada lagi pengucilan bagi warga yg terkonfirmasi. Jogo tonggo masih berjalan an terus digalakkan semoga semua masyarakat ikut berpartisipasi dalam program tersebut , terima kasih",Tidak ada keterangan
21 Apr 2021,https://laporgub.jatengprov.go.id/detail/LGWP99008317.html,KOTA PEKALONGAN,"Maaf hanya membantu menyampaikan... ada siswa orang tuanya tidak mampu, dr SMP sdh menerima pemberitahuan KIP beserta Kartunya. Dari awal menerima pemberitahuan (SMP) sampai sekarang 2 SMA tdk pernah menerima kemanfaatan kartu (sbg program bpk Presiden Jokowi). Saat SMP dijanjikan keluar tp tdk keluar, saat SMA sama (hanya memgumpulkan data) tapi tdk juga keluar. Mohon bantuannya, karena seorang janda penjual gorengan yg harus menghidupi 2 anak masih sekolah dan ibu yg sdh sepuh",Belum Diproses,Belum Diproses,Belum Diproses,Belum Diproses
22 Apr 2021,https://laporgub.jatengprov.go.id/detail/LGIG94440407.html,KOTA PEKALONGAN,"Masyarakat pekalongan kota memohon supaya truk"" bsr jgn dilewatkan ditengah""kota pekalongan donk..tlg jika ga keberatan dibuatin jln utara lg dijln kimangun sarkoro juga bs dilewatin keutara msh luas lalu ketimur arah batang. Jln sudirman-arah exit tol setono padat truk""bsr",Selesai,"Kamis, 29 April 2021 - 10:09 WIB","terimakasih untuk laporannya,, Pemkot pekalongan telah  mengusulkan program jalingkut ke pemerintah pusat karena untuk jalan lintas prov kewenangan pusat",Tidak ada keterangan
30 Apr 2021,https://laporgub.jatengprov.go.id/detail/LGWP07991156.html,KOTA PEKALONGAN,"Yth bapak Ganjar Pranowo. assalamualaikum mohon maaf pak sebelumnya saya ingin menyampaikan pendapat tentang ""larangan mudik"" pak ganjar perkenalkan sebelumnya saya elya agustina warga kota pekalongan , dimana keluarga terdiri ibu dan satu adik . sejak ayah saya meninggal tahun 2014, saya dan keluarga saya selalu merayakan lebaran dengan tiga orang saja pak. yang mana sejak 2014 ibu saya bekerja di jakarta dan setiap h-5 lebaran pasti pulang. pasti rasanya berbeda menjalankan puasa dan lebaran tanpa anggota lengkap. ditahun 2020 pandemi covid , mungkin perasaan saya lebih miris pak. bulan april 2020, saya pulang dari semarang (putus kontrak kerja karena pandemi) dan adik saya pulang dari surabaya (sma&pondok;) , kami pulang selisih satu hari dan kamipun isolasi mandiri di rumah yang mana makan hanya telur yg tersedia . di tahun 2020 , saya dan adik saya menjalankan puasa dan lebaran hanya berdua saja pak di rumah . tanpa kehadiran ibu kami. kami tahu covid 2020 penyebabnya dan kami bisa memahimnya. tapi pak ganjar, apakah ditahun 2021 kami harus mengulang hal yang sama? yang mana kami hanya ketemu ibu kami setahun sekali saat beliau pulang tapi kesempatan itupun hilang lagi karena pandemi. pak ganjar yang terhormat, apa bedanya ada larangan mudik tapi membuka wisata lokal (warga lokal) , bukankah itu kerumunan juga? apa bapak ganjar tahu, banyak warga yang mudik sebelum larangan mudik diturunkan dan mereka tidak pantau ataupun melakukan tes covid. bagaimana warga yg mudik itu ternyata covid tanpa gejala lalu menularkan ke warga lain saat lagi berwisata? kedua pak, apa pak ganjar tidak mempunyai solusi selain larangan mudik? mungkin pak ganjar bisa menyediakan travel yang supir nya pulang pergi harus tes antigen dan nose untuk warga yang mudik khusus jawa tengah. dan untuk penumpangnya wajib tes antigen juga saat penjemputan dan saat sampai dirumah. (artinya di travel ada petugas yg khusus untuk mengetes) . tak perlu gratis pak. biar tes dan travel bayar dengan pribadi agar warga jateng bisa mudik. sudah 7 tahun saya tinggal dirumah hanya dengan adik saya tanpa pendampingan orang dewasa tapi saya yakin pak banyak anak yatim yang ditinggal kerja ibunya masih kecil yg tinggal hanya dengan neneknya saja ataupun siapa pasti mereka rindu pak. Terimakasih",Selesai,"Jumat, 30 April 2021 - 09:51 WIB",DINAS PERHUBUNGAN,"Sesuai SE Gugus Tugas Nasional No SE 13 Tahun 2021, Mudik Dilarang kecuali dalam wilayah aglomerasi. Di Jawa Tengah, wilayah aglomerasi yg diperbolehkan adalah Solo Raya dan Semarang Raya. Sebaiknya dijadwal ulang setelah tgl 17 Mei 2021 nggih, suwun"
01 May 2021,https://laporgub.jatengprov.go.id/detail/LGWP81473662.html,KOTA PEKALONGAN,saya penerima bantuan bst tapi saya tdk menerima undangan utk mengambil bantuan tersebut,Belum Diproses,Belum Diproses,Belum Diproses,Belum Diproses
03 May 2021,https://laporgub.jatengprov.go.id/detail/LGAN76311714.html,KOTA PEKALONGAN,"mohon izin Yth.Bp Gubernur JATENG salam succes dan semoga sehat selalu saya UD.NUR JAYA selaku suppleyer beras mengajukan permohonan untuk ikut serta berkompetisi sebagai supleyer beras ke dinas sosial kodya/ kota pekalongan pada bulan april 2021 kami tidak bisa ikut serta dikarenakan sudah keluar edaran kuota dari dinas sosial kota pekalongan ke supleyer dan kemudian pada bulan ini mei kami diikutkan sesuai petunjuk dan arahan dinas sosial kota pekalongan untuk sosialisasi ke semua e warung dikota Pekalongan dan pada 3 mei kami UD. NUR JAYA memberikan hasil laporan kerja kami ke e warung ke Dinas Sosial kota pekalongan, yang jadi persoalan Yth.Bpk Gubenur JATENG bahwa dalam kebijakan yang ada berbeda dengan e warung. Yang menjadikan pertanyaan saya dengan e warung ke Dinas Sosial sama seperti yang tercantum di laporan hasil/kerja ke Dinas Sosial kodya Pekalongan. Atas wÃ ktu dan perhatiaannya kami ucapka banyak terimakasih.",Selesai,"Jumat, 07 Mei 2021 - 10:49 WIB",Terimakasih atas aduannya,Dalam hal ini kami dinsosp2kb kota pekalongan bertindak sebagai pembina E Warong hanya bertugas menerima berkas administrasi SIUP dan Uji Laboratorium calon suplayer dan cek kelengkapan administrasi.
04 May 2021,https://laporgub.jatengprov.go.id/detail/LGWP75648742.html,KOTA PEKALONGAN,"Maaf Pak Gubernur, mohon kebijakan Membayar Pajak Mobil Ganti Plat Nomor (khususnya BPKB) yang masih dileasing wajib membawa BPKB asli ditinjau ulang. Menggunakan legalisir BPKB dari leasing ditolak. Mau pinjam BPKB di leasing tidak boleh. Pengurusan perpanjangan Plat Nomor harus menggunakan Jasa yang direkomendasi dari Leasing. Biayanya Mahal dan Lama. Ini jelas merugikan konsumen dan masyarakat. Niatnya ingin menjadi warga yang baik dengan taat membayar pajak, tapi terkendala kebijakan yang merugikan konsumen. Mohon arahannya Pak Gub.",Selesai,"Selasa, 04 Mei 2021 - 16:05 WIB",BADAN PENGELOLA PENDAPATAN DAERAH,Assalamualaikum
04 May 2021,https://laporgub.jatengprov.go.id/detail/LGWA09899327.html,KOTA PEKALONGAN,"Alamat: Kabupaten Kota Pekalongan, Kecamatan Pekalongan Utara, Kelurahan Degayu Laporan: Selamat pagi Bapak Gubernur Saya Hery Nugroho, warga Jawa Tengah mau membayar pajak mobil perpanjangan STNK dan ganti plat G mobil di SAMSAT Kota PEKALONGAN tidak bisa alias ditolak, dikarenakan harus membawa BPKB mobil asli. Pengalaman beberapa tahun yang lalu dengan bekal Ligalisir BPKB dari leasing bisa. Untuk tahun ini, tidak bisa. Harus asli. Saat mau pinjam sebentar ke leasing dengan jaminan untuk pengurusan pajak tidak bisa. Harus lewat jasa yang direkomendasikan leasing dengan biaya yang mahal sekali dari pembayaran pajaknya dan butuh waktu yang lama (14 hari kerja). Sebagai warga negara yang taat, saya ingin membayar pajak tepat waktu, ternyata terkendala dengan masalah tersebut. Mohon bantuan Pak Gubernur berkenan kebijakan baru tersebut ditinjau ulang, karena sangat merugikan masyarakat Jateng dan mohon solusinya. Sebelumnya atas bantuannya disampaikan terima kasih. Semoga Pak Gubernur dan keluarga Besar pengelola Lapor Pak Gub selalu Sehat dan Sukses. Aamiin.",Selesai,"Kamis, 06 Mei 2021 - 07:54 WIB",BADAN PENGELOLA PENDAPATAN DAERAH,Assalamualaikum
04 May 2021,https://laporgub.jatengprov.go.id/detail/LGIG87319937.html,KOTA PEKALONGAN,"Maaf Pak Gubernur, beberapa hari yang lalu mau bayar pajak mobil Pekalongan yang BPKB dileasing sekarang rumit. Sudah pakai legalisir BPKB dari leasing di SAMSAT Kota Pekalongan di tolak. Mengurusnya harus lewat biro jasa dari leasing, bayarnya lebih mahal dan lama. Mohon kebijkan baru ini ditinjau ulang. Beberapa tahun yang lalu dengan memakai Legalisir dari Leasing bisa untuk bayar pajak dan ganti plat. Mohon arahannya Pak Gub.",Selesai,"Kamis, 12 Mei 2022 - 13:12 WIB",Kepolisian Daerah Jawa Tengah,Pengaduan telah ditindaklanjuti oleh anggota Satlantas Polres Pekalongan Kota
12 May 2021,https://laporgub.jatengprov.go.id/detail/LGWP46167940.html,KOTA PEKALONGAN,"Laporan saya tanggal 4 Mei 2021 di laman ini tentang pembayaran pajak mobil perpanjangan STNK dan ganti plat G mobil di SAMSAT Kota Pekalongan, alhamdulilah sudah ada solusi. Terima kasih atas respon cepat dan follow up dari Samsat dan Polres Kota Pekalongan. Semoga Samsat dan Polres Kota Pekalongan selalu sukses dan berkah. Aamiin. Mohon maaf ada kekurangan dan kesalahan. Maturnuwun.",Selesai,"Senin, 17 Mei 2021 - 15:36 WIB",BADAN PENGELOLA PENDAPATAN DAERAH,Assalamualaikum
17 May 2021,https://laporgub.jatengprov.go.id/detail/LGWA08106976.html,KOTA PEKALONGAN,"Alamat: Kabupaten kotaPekalongan, Kecamatan pekalonganTimur, Kelurahan noyontaansari Laporan: kenapa kluarga saya selama pandemi tidak mendapat bantuan sama sekali",Belum Diproses,Belum Diproses,Belum Diproses,Belum Diproses
18 May 2021,https://laporgub.jatengprov.go.id/detail/LGWA09546928.html,KOTA PEKALONGAN,"Alamat: Kabupaten kotapekalongan, Kecamatan pekalonganbarat, Kelurahan medono Laporan: mohon solusi pekalongan barat tdk mempunyai sma negeri klo untuk penerimaan siswa sma baru dengan sistem zonasi bagaimana kami yg ada di pekalongan barat mohon solusinya dan kebijakannya Sma 1 ada di pekalongan timur Sma 2 ada di pekalongan utara Sma 3 ada di pekalongan utara Sma 4 ada di pekalongan selàtan Tempat saya pekalongan barat belum ada sma nya Zonasi .. gak masuk smua nih pak... mohon solusinya Smoga hasil ujian akhir anak saya bagus jd ba masuk zona prestasi.. aamiiinnnn",Belum Diproses,Belum Diproses,Belum Diproses,Belum Diproses
18 May 2021,https://laporgub.jatengprov.go.id/detail/LGWP32960796.html,KOTA PEKALONGAN,Kenapa kluarga saya selama pandemi tidak mendapatkan bantuan apapun seperti warga lainnya padahal saya warga terdaftar dan mempunyai KTP,Belum Diproses,Belum Diproses,Belum Diproses,Belum Diproses
22 May 2021,https://laporgub.jatengprov.go.id/detail/LGWA26485067.html,KOTA PEKALONGAN,"Alamat: Kabupaten pekalongan, Kecamatan pekalongan barat, Kelurahan bendan kergon Laporan: Pagi pak saya mau lapor anak saya sakit leukemia dan harus menjalani pengobatan rutin sudah saya ajukan bantuan di pusat tetapi sampai sekarang tidak ada satupun yg keluar Sedangkan saya sudah bingung harus cari biaya dari mana lagi utang saya pun dah menumpuk banyak ..mohon bantuannya pak",Selesai,"Kamis, 26 Agustus 2021 - 12:10 WIB","bisa langsung datang ke kantor Dinas sosial Kota Pekalongan Jl. Sriwijaya No.40, Podosugih, Kec. Pekalongan Barat Kota Pekalongan, Jawa Tengah 51111",  Telepon: (0285) 422868
28 May 2021,https://laporgub.jatengprov.go.id/detail/LGIG97109326.html,KOTA PEKALONGAN,"selamat pagi pak. maaf menganggu. saya masyrakat awam biasa pak. mau nanya karna mungkin saya minim informasi. pak apa benar kecamatan / dukcapil sudah tidak mengeluarkan surat keterangan ktp sementara lagi? untuk pembuatan ktp baru. sudah rekam foto ktp dll. saya sudah bolak balik kesana,mnrt keterangan pihak kecamatan/dukcapil tidak bisa mengeluarkan surat keterangan sementara. sedangkan saya butuh surat keterangan itu untuk membuat skck. kalau menunggu KTP jadi 1 minggu, lowongan kerja nya sudah tutup pak. matursuwun pak ???? kecamatan pekalongan barat dan dinas kependudukan pekalongan barat kota pekalongan.",Selesai,"Rabu, 02 Juni 2021 - 10:34 WIB","Terima kasih atas masukannya. Mohon maaf, terkait surat keterangan untuk pengganti ktp-el memang sudah tidak boleh untuk dikeluarkan sesuai himbauan dari dukcapil pusat. Sebagai gantinya bapak/ibu dapat mengajukan permohonan biodata. Data yg ada pada biodata sama dengan data ktp tapi tetap tidak menggantikan fungsi ktp. Silahkan datang ke kantor dindukcapil untuk mengajukan permohonan biodata dengan membawa kk dan tanda terima perekaman ktp. Terima kasih semoga membantu????",Tidak ada keterangan
31 May 2021,https://laporgub.jatengprov.go.id/detail/LGIG11545660.html,KOTA PEKALONGAN,"Yg terhormat Bapak Ganjar, sy lg di Pekalongan ...astagfirulllah itu sungai Loji , makin sempit, makin dangkal, makin rimbun tanaman nya, gimana nggak banjir terus ...tolonglah pak, anggaran di turunkan utk membereskan kali loji, kalo nggak punya pasukan, serahkan ke saya pak, akan sy bereskan supaya Pekalongan jd indah, jangan Semarang aja yg di bikin indah pak ...Pekalongan butuh uluran tangan Bapak nih .",Selesai,"Kamis, 03 Juni 2021 - 07:46 WIB",DINAS PEKERJAAN UMUM SUMBER DAYA AIR DAN PENATAAN RUANG,Mohon program tersebut kita dukung bersama agar pembangunan tersebut bisa terlaksana dengan baik. Terima Kasih
31 May 2021,https://laporgub.jatengprov.go.id/detail/LGWP82078941.html,KOTA PEKALONGAN,"Mohon bantuannya Pak Ganjar Pranowo, Saya sudah daftar UMKM sampai sekarang juga belum mendapatkan bantuan modal. Memang saya punya tanggungan KUR mandiri, tapi kan bukan saya saja yang punya tanggungan KUR mohon di pertimbangkan Pak. Sekian dari saya, terima kasih",Selesai,"Rabu, 21 Juli 2021 - 13:03 WIB",DINAS KOPERASI DAN UMKM,Mohon maaf.. tetapi sesuai dengan petunjuk teknis memang yg sudah memiliki pinjaman di kur aktif otomatis tidak bisa mendapatkan BPUM. mohon maaf semua kebijakan langsung dr kementerian koperasi dan ukm RI
11 Jun 2021,https://laporgub.jatengprov.go.id/detail/LGWP64248453.html,KOTA PEKALONGAN,"ROB hampir tiap sore hingga malam di Klenteng Po An Thian, Pekalobgan Timur, Kota Pekalongan hingga masuk ke ruang altar. Banyak umat yang senior yang terpeleset karena rob ini. Terima kasih",Selesai,"Senin, 14 Juni 2021 - 14:36 WIB",kemarin2 sdh dipasang pipa knee di samping gereja utk mengendalikan air rob tp pihak klenteng minta pipa tsb utk dibongkar spy air hujan cpt mengalir ke sungai...sdh kami beritahukan konsekuensinya kl sungai pasang/rob air nt cpt menggenangi sekitar tp warga ttp bersikeras dibongkar... akhirnya spt itulah yg terjadi jawaban dari DPU Kota Pekalongan Terima kasih,Tidak ada keterangan
16 Jun 2021,https://laporgub.jatengprov.go.id/detail/LGWP13764121.html,KOTA PEKALONGAN,"hanya sekedar masukan,, ditengah pandemi yg masih kita hadapi..mungkin masyarakat masih banyak yg awam apa itu covid19 .. mohon kira nya digencarkan lagi sosialisasinya,, biar banyak masyarakat sadar prokes juga sadar arti JOGO TONGGO .. matursuwun...",Selesai,"Kamis, 17 Juni 2021 - 10:02 WIB","Jawaban dari Dinkes Pekalongan; Turut Prihatin, semoga kedepan lebih baik dan tidak ada lagi pengucilan bagi warga yg terkonfirmasi. Jogo tonggo masih berjalan an terus digalakkan semoga semua masyarakat ikut berpartisipasi dalam program tersebut , terima kasih",Tidak ada keterangan
17 Jun 2021,https://laporgub.jatengprov.go.id/detail/LGWP41150746.html,KOTA PEKALONGAN,"mohon kira nya gerakan #JOGO TONGGO# digencarkan ditengah pandemi yg sedang kita hadapi... biar tidak ad stigma negatif ataupun dikucilkan bagi penyintas covid 19.. sperti yg kami alami sekeluarga,,, dan yg sangat saya sayangkan istri saya tenaga kesehatan termasuk garda terdepan melawan covid19 tapi malah sperti dikucilkan..",Selesai,"Kamis, 17 Juni 2021 - 10:01 WIB","Jawaban dari Dinkes Pekalongan; Turut Prihatin, semoga kedepan lebih baik dan tidak ada lagi pengucilan bagi warga yg terkonfirmasi. Jogo tonggo masih berjalan an terus digalakkan semoga semua masyarakat ikut berpartisipasi dalam program tersebut , terima kasih",Tidak ada keterangan
