Date Posted,URL,Region,Message,Status,Resolved Date,Departement,Action
23 May 2022,https://laporgub.jatengprov.go.id/detail/LGWA55281331.html,KOTA PEKALONGAN,"Alamat: Kabupaten/Kota Pekalongan, Kecamatan pekalongan timur, Kelurahan kauman Laporan: pekalongan kota tiap hari rob,apa tidak sebaiknya jalan dicor ditinggikan",Selesai,"Selasa, 24 Mei 2022 - 09:58 WIB","DPUPR masih terus berupaya mengurangi genangan dengan mengoptimalkan pengoperasian pompa di stasiun pompa panjang baru, stasiun pomba panjang barat dan stasiun pompa sepucung.genangan di jalan tersebut berasal dari limpasan air rob dari kali loji. utk mengatasi limpasan tsb saat ini sedang proses pembangunan tanggul kali loji/CCSP di sepanjang kali loji melalui PAKET I (pekerjaan pengendalian banjir dan rob loji banger) utk mengurangi genangan yg ada, saat ini sudah dioperasikan 2 pompa monie di ujung pertemuan saluran kutilang/kali loji. disamping itu pada tahun 2022 ini, akan segera dibangun stasiun pompa kutilang dan rehabilitasi drainase sekkitar jl wr supratman.","  untuk mengurangi genangan yg ada, saat ini kai mengoptimalkan peengoperasian stasiun pompa di stasiun pompa tirto meduri dan menempatkan pompa mobile di tirto bremi (RW 1) serta beberapa pompa skala lingkungan. disamping itu tahun ini akan dibangun stasiun pompa tirto meduri (Barat kali meduri/RW 4) dan pembangunan stasiun tirto bremi (RW 1)"
23 May 2022,https://laporgub.jatengprov.go.id/detail/LGWA64541027.html,KOTA PEKALONGAN,"Alamat: Kabupaten/Kota pekalongan, Kecamatan pekalonganutara, Kelurahan panjangwetan Laporan: jl kutilang rob makin parah belum ada tindakan",Selesai,"Selasa, 24 Mei 2022 - 09:57 WIB","DPUPR masih terus berupaya mengurangi genangan dengan mengoptimalkan pengoperasian pompa di stasiun pompa panjang baru, stasiun pomba panjang barat dan stasiun pompa sepucung.genangan di jalan tersebut berasal dari limpasan air rob dari kali loji. utk mengatasi limpasan tsb saat ini sedang proses pembangunan tanggul kali loji/CCSP di sepanjang kali loji melalui PAKET I (pekerjaan pengendalian banjir dan rob loji banger) utk mengurangi genangan yg ada, saat ini sudah dioperasikan 2 pompa monie di ujung pertemuan saluran kutilang/kali loji. disamping itu pada tahun 2022 ini, akan segera dibangun stasiun pompa kutilang dan rehabilitasi drainase sekkitar jl wr supratman.","  untuk mengurangi genangan yg ada, saat ini kai mengoptimalkan peengoperasian stasiun pompa di stasiun pompa tirto meduri dan menempatkan pompa mobile di tirto bremi (RW 1) serta beberapa pompa skala lingkungan. disamping itu tahun ini akan dibangun stasiun pompa tirto meduri (Barat kali meduri/RW 4) dan pembangunan stasiun tirto bremi (RW 1)"
23 May 2022,https://laporgub.jatengprov.go.id/detail/LGWA31252821.html,KOTA PEKALONGAN,"Alamat: Kabupaten/Kota pekalongan, Kecamatan pekalonganutara, Kelurahan panjangwetan Laporan: jl kutilang rob makin parah belum ada tindakan",Belum Diproses,Belum Diproses,Belum Diproses,Belum Diproses
23 May 2022,https://laporgub.jatengprov.go.id/detail/LGWA77101918.html,KOTA PEKALONGAN,"Alamat: Kabupaten/Kota pekalongan, Kecamatan pekalonganutara, Kelurahan panjangwetan Laporan: jl kutilang rob makin parah belum ada tindakan",Belum Diproses,Belum Diproses,Belum Diproses,Belum Diproses
23 May 2022,https://laporgub.jatengprov.go.id/detail/LGWA70064155.html,KOTA PEKALONGAN,"Alamat: Kabupaten/Kota pekalongan, Kecamatan pekalonganutara, Kelurahan panjangwetan Laporan: jl kutilang rob makin parah belum ada tindakan",Selesai,"Selasa, 24 Mei 2022 - 09:56 WIB","DPUPR masih terus berupaya mengurangi genangan dengan mengoptimalkan pengoperasian pompa di stasiun pompa panjang baru, stasiun pomba panjang barat dan stasiun pompa sepucung.genangan di jalan tersebut berasal dari limpasan air rob dari kali loji. utk mengatasi limpasan tsb saat ini sedang proses pembangunan tanggul kali loji/CCSP di sepanjang kali loji melalui PAKET I (pekerjaan pengendalian banjir dan rob loji banger) utk mengurangi genangan yg ada, saat ini sudah dioperasikan 2 pompa monie di ujung pertemuan saluran kutilang/kali loji. disamping itu pada tahun 2022 ini, akan segera dibangun stasiun pompa kutilang dan rehabilitasi drainase sekkitar jl wr supratman.","  untuk mengurangi genangan yg ada, saat ini kai mengoptimalkan peengoperasian stasiun pompa di stasiun pompa tirto meduri dan menempatkan pompa mobile di tirto bremi (RW 1) serta beberapa pompa skala lingkungan. disamping itu tahun ini akan dibangun stasiun pompa tirto meduri (Barat kali meduri/RW 4) dan pembangunan stasiun tirto bremi (RW 1)"
23 May 2022,https://laporgub.jatengprov.go.id/detail/LGWA65472410.html,KOTA PEKALONGAN,"Alamat: Kabupaten/Kota pekalongan, Kecamatan pekalonganutara, Kelurahan panjangwetan Laporan: jl kutilang dan sekitarnya rob makin tinggi,banjir dan jalanan rusak sangat membahayakan untuk para org tua yg mengendarai motor",Belum Diproses,Belum Diproses,Belum Diproses,Belum Diproses
24 May 2022,https://laporgub.jatengprov.go.id/detail/LGIG89851801.html,KOTA PEKALONGAN,"Jalan kusuma Bangsa, WR. Supratman tolong ditinggikan pak. Proyek tanggul laut belum dikerjakan secara tuntas. Rob kemarin airnya sudah melewati tanggul, kl begini fungsinya tanggul laut apa? Bikinnya nanggung",Selesai,"Senin, 30 Mei 2022 - 14:52 WIB","DPUPR masih terus berupaya mengurangi genangan dengan mengoptimalkan pengoperasian pompa di stasiun pompa panjang baru, stasiun pomba panjang barat dan stasiun pompa sepucung.genangan di jalan tersebut berasal dari limpasan air rob dari kali loji. utk mengatasi limpasan tsb saat ini sedang proses pembangunan tanggul kali loji/CCSP di sepanjang kali loji melalui PAKET I (pekerjaan pengendalian banjir dan rob loji banger) utk mengurangi genangan yg ada, saat ini sudah dioperasikan 2 pompa monie di ujung pertemuan saluran kutilang/kali loji. disamping itu pada tahun 2022 ini, akan segera dibangun stasiun pompa kutilang dan rehabilitasi drainase sekkitar jl wr supratman.",Tidak ada keterangan
02 Jun 2022,https://laporgub.jatengprov.go.id/detail/LGWP31234635.html,KOTA PEKALONGAN,"Pak selaku warga kota pekalongan, kec pekalongan utara, desa kandang panjang. saya mau lapor mengenai jalan sepanjang jalan kandang panjang gg 7 dari kelurahan kandang panjang ke selatan rusak parah,setiap hujan selalu banjir,rob pun ikut banjir lagi,kalau pas kering kelihatan rusak banyak kerikil berceceran yg menyebabkan pengendara kadang jatuh. Mohon untuk diusulkan perbaikan jalan dan ditinggikan jalannya agar tidak banjir,karena semua gang yg ada disini sudah ditinggikan dan di cor,hanya sepanjang jalan gg 7 saja yg belum,alasannya itu jalan provinsi katanya,jadi harus laporan provinsi. Mohon dipertimbangkan usul saya untuk bisa di perbaiki dan ditinggikan jalannya pak. Terima kasih.",Selesai,"Senin, 06 Juni 2022 - 08:52 WIB","Sudah masuk ke dalam usulan musrenbangkel tiap tahun dan sudah masuk ke Dinperkim Kota Pekalongan tinggal menunggu antrian saja untuk realisasinya, dan untuk gang 7 sebagian sudah dikerjakan tahun ini. Mohon bersabar dan terima kasih. mohon dengan hormat bantuan, kerjasama dan pengertiannya, kepada semua warga dan pengguna jalan, untuk tidak melewati jalan Gg 7 Raya yang baru selesai dikerjakan/dicor, monggo pak Ketua RT/RW bisa disosialisasikan kepada warganya, mtr nuwun",Tidak ada keterangan
06 Jun 2022,https://laporgub.jatengprov.go.id/detail/LGWP17959322.html,KOTA PEKALONGAN,"Lapor pk ganjar. Apakah SOP bank jateng emng pilih pilih dalam melayani konsumen?. Senin tgl 6 juni 2022 saya datang ke kantor bank jateng yang berada di bappeda kota pekalongan untuk melakukan pembayaran pajak PBB dengan lokasi objek pajak beralamat di kabupaten pekalongan. Lagi"" saya ditolak, hari ini ditolak dengan alasan sistem eror jika mau melakukan pembayaran pajak pbb untuk daerah kabupaten pekalongan. Hal serupa juga pernah terjadi, saya datang tapi disuruh menunggu menjelang jam tutup (kebetulan dulu dateng pd hari jumat) Kok kesannya bank jateng hanya melayani pbayaran pajak pbb sesui daerahnya. Jadi sehabis saya ditolak dengan alasan sistim eror, saya langsung ke bank jateng wiradesa kabupaten pekalongan. Dan benar saya, seperti asumsiku bahwa sistem tidak error, itu terbukti dengan pembayaran pajak pbb bisa terbayar dg lancar. Mohon untuk pihak bank jateng agar memberi teguran kepada karyawan bank jateng khususnya yang bekerja dibank jateng bappeda kota pekalongan, agar hal serupa tidak terulang kembali. Kita sebagai warga negara yang baik, yang ingin ikit serta mensukseskan pembangunan di provinsi jawa tengan, dengan membayar pajak tepat waktu akan tetapi mendapat pelayanan yang mengecewakan. Jika masyarakat malas bayarpajak, yang rugi pemerintah daerah, tolong kepada pihak yang berwewenang agar memberi teguran. Sekian terima kasih.",Selesai,"Selasa, 07 Juni 2022 - 10:30 WIB",BANK JATENG,"Bapak Supriyanto, Bank Jateng telah menindaklanjuti semua pengaduan Bapak baik melalui twitter maupun Lapor Gub Bank Jateng. Terkait pembayaran PBB dapat kami informasikan bahwa pembayaran PBB dapat dilakukan di mana pun dan sebagai informasi Bank Jateng Kantor Kas Pemkot Pekalongan telah berupaya agar jaringan lebih stabil dan tidak terjadi error sehingga disarankan untuk menunggu terlebih dahulu. Bank Jateng telah menindaklanjuti dengan menghubungi Bapak Supriyanto dan beliau menyampaikan bahwa perkara sudah dianggap selesai. Terimakasih atas masukannya. Matursembah nuwun. Terimakasih sudah menggunakan layanan Bank Jateng. Sehat selalu. "
07 Jun 2022,https://laporgub.jatengprov.go.id/detail/LGWA12811947.html,KOTA PEKALONGAN,"Alamat: kotapekalongan, Kecamatan pekalonganutara, Kelurahan panjangbaru Laporan: Pak gubernur yang terhormat.mohon bangunan akses jalan yang memadai jgn selalu menggenang air rob yg berakibat merusak kendaraan dan mood kami warga terdampak rob yg hampir tiap hari.tolong pakk bantu kami biar rob segera sirna dr Pekalongan utara biar bs melakukan aktivitas yg layak seperti org2 lain.ketika hujan pun yg seharusnya org Islam bersyukur krn doa ijabah,sy sebagai warga pesisir selalu merasa was2 dan menangis berdoa supaya hujan g turun deras.",Selesai,"Rabu, 15 Juni 2022 - 11:05 WIB","Usai menyelesaikan proses tahap lelang, empat pekerjaan fisik peningkatan jalan yakni Jalan Angkatan 66, Jalan Karya Bhakti, Jalan KH Bukhori, dan Jalan WR Supratman dalam waktu dekat akan segera dilaksanakan rekonstruksi atau perbaikan jalan oleh Pemerintah Kota Pekalongan melalui Dinas Pekerjaan Umum dan Penataan Ruang (DPUPR). Hal ini terungkap dalam kegiatan Rapat Pre Contruction Meeting dengan mengundang stakeholder terkait diantaranya Dinas Perhubungan, Dinas Kominfo, Satuan Lalu Lintas (Satlantas) Polres Pekalongan Kota para lurah, camat, PT PLN, PT Telkom,  PT Perumda Tirtayasa, Pejabat Pelaksana Teknis Kegiatan(PPTK), Pejabat Pembuat Komitmen (PPKom), Kejaksaan, tim teknis,  dan para pelaksana (kontraktor),kegiatan Pre Construction Meeting (PCM) ini merupakan rapat awal untuk koordinasi sebelum dilaksanakannya pekerjaan 4 paket pekerjaan konstruksi peningkatan jalan, yakni Jalan Angkatan 66, Jalan Karya Bakti, Jalan KH Bukhori dan Jalan WR Supratman. Keempat paket pekerjaan ini bersumber dari Dana Alokasi Khusus (DAK) Pemerintah Pusat. Menurutnya, sebelumnya, pada sekitar Bulan Mei-Juni, keempat paket pekerjaan ini sudah melalui proses lelang dan sudah ada pemenang masing-masing pelaksananya.",Tidak ada keterangan
09 Jun 2022,https://laporgub.jatengprov.go.id/detail/LGWA30550993.html,KOTA PEKALONGAN,"Alamat: kota pekalongan, Kecamatan pekalongan timur, Kelurahan klego Laporan: pengajuan pengembalian uang PLN setelh hmpir 3 buln blm cair katny suruh nunggu 3bln lg nunggu proses verif UID..",Selesai,"Sabtu, 11 Juni 2022 - 06:22 WIB",DINAS ENERGI DAN SUMBER DAYA MINERAL,"Dapat kami sampaikan bahwa proses restitusi memang memerlukan waktu untuk verifikasi ke pusat. Tetapi dapat kami pastikan uang sdr tidak hilang, hanya perlu menunggu waktu verifikasi."
16 Jun 2022,https://laporgub.jatengprov.go.id/detail/LGWP39370128.html,KOTA PEKALONGAN,"Assalamualaikum wr wb. Selamat pagi pak Gub. Lapor pak, ada peserta seleksi paskibra tingkat provinsi Jawa tengah dari perwakilan Kota Pekalongan yaitu Revan Arjunan M nomor dada 53 yg diloloskan oleh panita,padahal ybs tdk memenuhi syarat, ybs tingginya hanya 168 Cm sedangkan ketentuannya utk peserta putra minimal 170 cm. Mohon Pak Gub utk mengecek kembali ke panitia nya dan mestinya peserta tsb didiskualifikasi. Matur nuwun pak Gub, salam hormat dari saya",Selesai,"Senin, 11 Juli 2022 - 15:45 WIB","DINAS KEPEMUDAAN, OLAHRAGA DAN PARIWISATA",Waalaikumsalam wr.wb.
16 Jun 2022,https://laporgub.jatengprov.go.id/detail/LGWA81097326.html,KOTA PEKALONGAN,"Alamat: kotapekalongan, Kecamatan kecamatanoekalonganbarat, Kelurahan kelurahanmedono Laporan: Assalamualaikum wr wb. Selamat pagi pak Gub. Lapor pak, ada peserta seleksi paskibra tingkat provinsi Jawa tengah yg diloloskan oleh panita padahal ybs tdk memenuhi syarat yaitu Revan Arjunan M, wakil dari Kota Pekalongan, ybs tingginya hanya 168 Cm sedangkan ketentuannya utk peserta putra minimal 170 cm. Mohon Pak Gub utk mengecek kembali ke panitia nya dan mestinya peserta tsb didiskualifikasi. Matur nuwun pak Gub, salam hormat dari saya.",Belum Diproses,Belum Diproses,Belum Diproses,Belum Diproses
16 Jun 2022,https://laporgub.jatengprov.go.id/detail/LGWA47913941.html,KOTA PEKALONGAN,"Alamat: Kabupaten/Kota Kota Pekalongan, Kecamatan Kecamatan Pekalongan Timur , Kelurahan Kelurahan Kauman Laporan: Keluhan ( mau tnya daftar online jenjang SMK /SMA cuman salah klik daftarnya SMA yg aslinya mau daftar SMK bisa d bantu pengaduan kemana ga ya",Belum Diproses,Belum Diproses,Belum Diproses,Belum Diproses
20 Jun 2022,https://laporgub.jatengprov.go.id/detail/LGWA62147748.html,KOTA PEKALONGAN,"Alamat: Kabupaten/Kota Kota Pekalongan, Kecamatan Pekalongan Utara, Kelurahan Panjang Wetan Laporan: Adanya bangunan di atas saluran drainase yang menyebabkan air susah mengalir ketika banjir, dan juga saluran drainase yang tidak pernah dikeruk jadi air cepat penuh, pihak rt, rw dan kelurahan tidak pernah bertindak",Selesai,"Kamis, 23 Juni 2022 - 09:55 WIB",Perbaikan Gorong-gorong/Drainase Jl. WR. Supratman tahun 2022 ini sdh dianggarkan (termasuk Drainase Jl. Kusuma Bangsa dan Pembangunan St. Pompa Kutilang). Rencananya Drainase di Jl. WR. Supratman diarahkan ke Stasiun Pompa Panjang Wetan dan Sipucung utk kemudian dipompa/dibuang ke Kali Loji.,Tidak ada keterangan
20 Jun 2022,https://laporgub.jatengprov.go.id/detail/LGWA31163005.html,KOTA PEKALONGAN,"Alamat: Kabupaten/Kota Kota Pekalongan, Kecamatan Kec.Pekalongan Utara, Kelurahan Kel. Panjang Wetan Laporan: Keluhan Mau lapor utk Daerah Kota Pekalongan terutama Pekalongan Utara jalan WR. Supratman arah ke tmpt wisata pantai pasir putih jalan rusak 2 jalur lubang besar dr beberapa tahun yg lalu dr sebelum covid hingga skrg tidak ada tindakan perbaikan jalan???? Jd klo hujan qt hrs melewati jln alternatif yg skrg suka rob tinggi walopun tidak hujan. Jd klo hujan qt terjebak tdk bs kmn² pernah anak² jd libur seminggu krn banjir ga bisa lwt. Ga bisa kerja, ga bisa melakukan aktivitas jg. Mohon bantuannya pak",Selesai,"Kamis, 23 Juni 2022 - 09:53 WIB",  Perbaikan Gorong-gorong/Drainase Jl. WR. Supratman tahun 2022 ini sdh dianggarkan (termasuk Drainase Jl. Kusuma Bangsa dan Pembangunan St. Pompa Kutilang). Rencananya Drainase di Jl. WR. Supratman diarahkan ke Stasiun Pompa Panjang Wetan dan Sipucung utk kemudian dipompa/dibuang ke Kali Loji.,Tidak ada keterangan
21 Jun 2022,https://laporgub.jatengprov.go.id/detail/LGWP31691775.html,KOTA PEKALONGAN,Jalan Wr. Supratman pekalongan utara rusak parah. Berlubang besar 2 jalur sehingga tdk bs dilewati kendaraan. Tdk ada perbaikan dr bbrp tahun yg lalu dr sebelum covid hingga saat ini. Dan di depan jatayu regency jalan wr. Supratman pun rob. Alternatif lain qt harus melewati jl. Kusuma bangsa. Tp klo hujan banjir tinggi sehingga qt terjebak mobil motor tdk bs lwt. Tdk bs beraktivitas kurleb seminggu.,Belum Diproses,Belum Diproses,Belum Diproses,Belum Diproses
21 Jun 2022,https://laporgub.jatengprov.go.id/detail/LGWA64332243.html,KOTA PEKALONGAN,"Alamat: Kabupaten/Kota KotaPekalongan, Kecamatan PekalonganSelatan, Kelurahan Jenggot Laporan: Assalamu'alaikum pak gubernur ku tercinta pak ganjar, smg pak ganjar sllu diberikan taufiq dan hidayah oleh ALLOH...Amiiin. ngapunten pak nderek curhat, istri kulo PNS guru SMAN 1 Bandar kab. Batang jateng, setiap hari menempuh perjalanan menggunakan sepeda motor sejauh 25 KM bolak balik, krn istri ikut saya tinggal di Kota pekalongan, saya kasihan pak sama istri, jalan nya banyak yg rusak menuju bandar dan kami berencana utk Punya Keturunan, sehingga kami khawatir. Nah pak karena SMAN ada di kewenangan pemprov, maka saya mohon dengan sangat agar istri saya bisa dibantu mutasi ngajar berkhidmah di SMAN yang ada di kota pekalongan saja, mohon saestu ya pak. Istri saya namanya Rr. Angelia Dhini Seffina Matur nuwun sanget pak Wassalamu'alaikum Ttd suami, yg hanya seorang pekerja ojol",Belum Diproses,Belum Diproses,Belum Diproses,Belum Diproses
21 Jun 2022,https://laporgub.jatengprov.go.id/detail/LGWA43691997.html,KOTA PEKALONGAN,"Alamat: kota Pekalongan, Kecamatan kecamatan Pekalongan barat, Kelurahan kelurahan Sapuro kebulen Laporan: tolong bantu saya untu bedah rumah buat tetangga saya",Selesai,"Rabu, 22 Juni 2022 - 17:08 WIB",DINAS PERUMAHAN RAKYAT DAN KAWASAN PERMUKIMAN,"menanggapi laporan yang saudara sampaikan monggo dapat berkoordinasi dng pemerintah kelurahan, agar dpt diusulkan ke dinas perumahan kota pekalongan dan bazda kota pekalongan."
26 Jun 2022,https://laporgub.jatengprov.go.id/detail/LGWA21991930.html,KOTA PEKALONGAN,"Alamat: Kabupaten/Kota Kota Pekalongan, Kecamatan Kec.Pekalongan Utara, Kelurahan Kel. Panjang Wetan Laporan: Keluhan Jl. Wr. Supratman berlubang besar menutupi 2 jalur kendaraan tidak diperbaikin dr sebelum covid sampai sekarang. Sebelumnya sudah komplain tp jawabannya melenceng ke perbaikan gorong² yg rob. Tp jawaban yg jalan lubang besar ga dijawab.",Selesai,"Rabu, 29 Juni 2022 - 08:29 WIB"," mulai minggu ini pekerjaan perbaikan  Jl. WR Supratman sdh mulai.. 28-6-22, terimakasih laporan nya",Tidak ada keterangan
28 Jun 2022,https://laporgub.jatengprov.go.id/detail/LGWA77829619.html,KOTA PEKALONGAN,"Alamat: Kabupaten/Kota pekalongan, Kecamatan pekalongantimur, Kelurahan noyontaansari Laporan: selamat sore saya mau menyampaikan keluhan terkait usulan formasi pppk guru oleh pemda mohon bisa ditambahkan lagi usulan formasi pppk guru jawa tengah khususnya shingga bisa mengakomodir guru yang lulus pg di jawa tengah",Belum Diproses,Belum Diproses,Belum Diproses,Belum Diproses
30 Jun 2022,https://laporgub.jatengprov.go.id/detail/LGWP27311245.html,KOTA PEKALONGAN,"Assalamu'alaikum Wr.Wb. Mf.Pak mohon diteruskan ke pak Ganjar.Saya siswa madrasah yg berakteditasi B,karena nilai akreditasi B adalah 0.9.maka nilai yg saya dapat meskipun sdh bagus harus dikalikan 0.9 hingga hasilnya menjd sedikit atau berkurang sampai 4.Sehingga otomatis tergusur dari yg berakteditasi A.Untuk itu saya merasa terdiskriminasi dan dibedakan,rasanya tdk adil buat saya. Dengan demikian saya mohon agar akteditasi A maupun B tdk ada perbedaan nilai sehingga tdk mempersulit kami yg dari akreditasi B.Semoga aduan ini ditindak lanjuti,Terimakasih,mohon maaf.???????? Wassalamu'alaikum wr.wb.",Belum Diproses,Belum Diproses,Belum Diproses,Belum Diproses
30 Jun 2022,https://laporgub.jatengprov.go.id/detail/LGWA39865427.html,KOTA PEKALONGAN,"Alamat: Kabupaten/Kota Kota Pekalongan, Kecamatan Kecamatan Pekalongan Utara, Kelurahan Kelurahan Degayu Laporan: Yang terhomat bapak gubernur, saya mau melapor bahwa jalan di kampung saya dukuh clumprit kelurahan degayu pekalongan utara harus segera ditinggikan, selama ini jalanan terendam banjir. Kondisi jalan sudah rusak tidak beraspal lagi, selain membahayakan pengendara kami juga mengalami banyak kendala dalam hal kerusakan kendaraan akibat jalanan yg dilalui terendam air rob. Mohon untuk segera ditinjau dan diperbaiki. Terimakasih",Selesai,"Jumat, 01 Juli 2022 - 08:13 WIB",Perbaikan/Peningkatan jalan desa Clumprit (Jl. Labuan I) sdh dianggarkan di tahun 2022 ini.,"Perbaikan jalan di Clumprit, Degayu sdh dianggarkan di tahun 2022 ini melalui Paket Pekerjaan Peningkatan Jl. Labuhan 1 dan Pekerjaan Rehabilitasi Jembatan dan Jalan Suromelati. Progres kedua Paket Pekerjaan tsb skr sedang dalam proses lelang dan insyaAllah pelaksanaan pekerjaan fisik bs segera mulai dilaksanakan."
02 Jul 2022,https://laporgub.jatengprov.go.id/detail/LGWP67926800.html,KOTA PEKALONGAN,"Selamat malam Bapak, mau bertanya bagaimana prosedur untuk menjadi pegawai penyapu jalan ya pak? Terima kasih",Selesai,"Senin, 04 Juli 2022 - 08:34 WIB",Monggo membuat surat lamaran saja yang ditujukan kepada kepala DLH Kota Pekalongan. Terima kasih,Tidak ada keterangan
04 Jul 2022,https://laporgub.jatengprov.go.id/detail/LGWP91095700.html,KOTA PEKALONGAN,"Lapor Pak Ganjar, mohon diinvestigasi dana Bantuan Operasional Sekolah / PIP disekolah SMA3 kota pekalongan tidak disalurkan 100% ke siswa. Terima kasih",Belum Diproses,Belum Diproses,Belum Diproses,Belum Diproses
04 Jul 2022,https://laporgub.jatengprov.go.id/detail/LGWP44839299.html,KOTA PEKALONGAN,"Mohon bantuannya mengenai pengaspalan di pasar banyurip kota pekalongan, karena beritanya sudah heboh di group medsos facebook, dan di masyarakat sekitaran pasar. Info link facebook https://www.facebook.com/1572561199697461/posts/pfbid0GBY28PvZCQ4rZ5zDB5hwGaRtfX6oZxhVb4nDq9MzeiMGruZpavSd5cFNgr99PU3dl/",Belum Diproses,Belum Diproses,Belum Diproses,Belum Diproses
06 Jul 2022,https://laporgub.jatengprov.go.id/detail/LGWP99738276.html,KOTA PEKALONGAN,"Tolong untuk pelayanan di kantor kelurahan PODOSUGIH di perbaiki,,, kita sudah menyerahkan semua syarat mau bikin surat kematian dari bulan april sampai sekarang brlum ada tanggapan,, tp waktu kita datang ke kantor kelurahan dari pihak kelurahan bilang kalau arsipnya tidak ada di kantor alias hilang,, tp dari pihak kelurahan tidak ada tanggung jawabnya,, malah di suruh buat lagi,, tolong kasih tindakan ke pihak kantor kelurahan PODOSUGIH biar kedepanya lebih hati hati,,, terima kasih",Selesai,"Jumat, 15 Juli 2022 - 08:52 WIB","ybs yidak membawa dokumen asli misal KTP ( almarhum) dan KK karna tiap pengajuan surat keterangan kematian harus dengan KK dan KTP asli dan utk berkas pendukung yg katanya hilang oleh petugas di suruh bawa pulang dulu utk dilengkapi dengan KK dan KTP yg asli ????????????????Jawaban dari Kel Podosugih, Terimakasih laporan nya",Tidak ada keterangan
06 Jul 2022,https://laporgub.jatengprov.go.id/detail/LGWP74659384.html,KOTA PEKALONGAN,"Saya supriyanto ingin mengajukan permohonan penghapusan aduan saya, tanggal aduan 06/07/2022 mengenai pengaspalan di pasar banyurip. Karena info yang saya adukan tidak falid dn tidak benar. Mohon sekirannya tim verifikator mau menghapus aduan saya. Sekian terima kasih.",Belum Diproses,Belum Diproses,Belum Diproses,Belum Diproses
09 Jul 2022,https://laporgub.jatengprov.go.id/detail/LGWA89747095.html,KOTA PEKALONGAN,"Alamat: kota pekalongan, Kecamatan kecamatan pekalongan barat, Kelurahan kelurahan sapuro Laporan: keluhan apa bisa ngurus akte lahir di rs tempat lahir anak nya? Ini saya udah ngurus akte lahir anak saya di rs tpi kok udah hampir 1bulan blom jadi makasih pak ganjar tolong di tindak lanjuti",Selesai,"Senin, 11 Juli 2022 - 15:10 WIB"," kelurahan hanya bikin surat pengantar ke dinduk capil saja.. yg memproses dr dinduk capil, Bisa langsung ke kantor dindukcapil Kota Pekalongan Jl. Majapahit No.18, Bendan, Pekalongan Bar., Kota Pekalongan, Jawa Tengah 51111, Indonesia. Nomor telepon: (0285) 422814, terimakasih laporan nya",Tidak ada keterangan
18 Jul 2022,https://laporgub.jatengprov.go.id/detail/LGTW97389059.html,KOTA PEKALONGAN,Sore ini rob kembali genangani jalan di kawasan budayaa jetayu kota pekalongan. Sampai kapan ya lhur kya iki trs ???????? Wag @pekalongantrending #pekalongantrending #mediaofpekalongan #pekalongan,Selesai,"Kamis, 21 Juli 2022 - 08:05 WIB",Sumber Rob di Kawasan Budaya Jetayu berasal dari Kali Loji yg limpas..,Upaya yg dilakukan:
22 Jul 2022,https://laporgub.jatengprov.go.id/detail/LGIG18710763.html,KOTA PEKALONGAN,lapor gub..upah honorer pendidikan dilingkungan SMA/SMK kenapa selalu terlambat ? Mohon ditindak lanjuti karena sudah menjadi agenda bulanan dinas pendidikan dan cabang dinas pendidikan. Harusnya hal ini tidak terjadi karena berkaitan dengan hajat hidup orang banyak. Terima kasih. Lokasi SMAN 4 Pekalongan,Belum Diproses,Belum Diproses,Belum Diproses,Belum Diproses
27 Jul 2022,https://laporgub.jatengprov.go.id/detail/LGWP84371984.html,KOTA PEKALONGAN,"Tolong Tertibkan Lokalisasi/ Tempat Portitusi di Desa Bendan Sari kecamatan PasirKratonKramat Pekalongan barat. Karena di daerah tersebut sudah tidak terkendali, apalagi adanya isu HiV AID yang di bawa PSK. Sehingga saya selaku masyarakat disini saya merasa terganggu dan kurang nyaman..",Selesai,"Senin, 12 September 2022 - 14:28 WIB",Kepolisian Daerah Jawa Tengah,Berdasarkan surat Kapolres Pekalongan Kota Nomor: R/644/IX/WAS.2.4./2022 7 September 2022 menjelaskan bahwa pengaduan Laporgub a.n. Ananda Giebran tanggal 28 Juli 2022 telah ditindaklanjuti oleh Kapolres Pekalongan Kota dan anggota dengan melakukan penyelidikan dan mendatangi lokasi yang dilaporkan yaitu di daerah Bendansari
