Date Posted,URL,Region,Message,Status,Resolved Date,Departement,Action
12 Mar 2021,https://laporgub.jatengprov.go.id/detail/LGWP72588223.html,KOTA MAGELANG,"Mohon maaf pak Gubernur pimpinan kami, saya salah satu orang tua mewakili seluruh peserta padus pesparawi anak tahun 2020 minta tolong mohon untuk segera menandatangami piagam lomba padus pesparawi anak jateng yang diadakan di Semarang juara 1 untuk tambahan nilai prestasi mencari sekolah negri terimakasih atas perhatiannyaðŸ™ðŸ»",Selesai,"Jumat, 21 Mei 2021 - 14:15 WIB",Kanwil Kemenag Provinsi Jawa Tengah,"Menanggapi Aduan Masyarakat ke laporgub.jatengprov.go.id terkait Piagam Lomba Padus Pesparawi Anak Jawa Tengah  atas belum diterbitkannya Sertifikat /Piagam oleh Lembaga Pengembangan Pesparawi Daerah (LPPD) , maka kami sampaikan hal - hal sebagai berikut : 1. Lembaga Pengembangan Pesparawi Daerah (LPPD) Provinsi Jawa Tengah telah melakukan Perubahan Kewenangan Pemberian Tanda tangan di sertifikat/ Piagam Penghargaan Lomba Padus Pesparawi Anak Jawa Tengah sesuai Surat dari Pemprov. jateng Nomor : 421/0003602 tanggal 05 Maret 2021 Perihal : Tanda tangan Sertifikat dan Piagam Penghargaan. 2. Lembaga Pengembangan Pesparawi Daerah (LPPD) telah melakukan Proses Pencetakan Setifikat/Piagam yang nantinya akan diterbitkan dan diberikan kepada Pemenang Lomba Padus Pesparawi Anak Jawa Tengah."
26 Mar 2021,https://laporgub.jatengprov.go.id/detail/LGWP57200753.html,KOTA MAGELANG,Mohon bantuanny pak Ganjar.. d SD Rejowinangun utara 3 tempat Anak sya sekolah oknum Guru PJOK bernama Pak Bambang tidak memberi pelajaran untuk anak didik.. semester 1 hanya 1 kali memberi tugas.. semester 2 juga hanya 1kali setelah saya protes k kepala sekolah.. dn pihak kepala sekolah pun sudah Bingung harus berbuat apa untuk Guru PJOK.. karna sudah Lapor Dinas pendidikan Magelang kota juga tidak ad hasil... di duga guru PJOK ad orang kuat puny jabatan d DPRD yg melindungi pak Bambang ini.. karna pihak DikNas juga tidak bisa ambil sikap tegas k Oknum Guru ini.. sudah ber tahun2 info yg saya dpt pak Bambang ini jarang memberi pelajaran k anak didik... mau jadi apa generasi bangsa kl oknum guru seperti ini.. mohon d tindak Tegas Pak Ganjar..,Selesai,"Senin, 05 April 2021 - 08:31 WIB",Kota Magelang,"Menanggapi laporan dari Sdr. Susetyono perihal kinerja Guru PJOK SD Rejowinangun Utara 3 atas nama Bambang bersama ini kami sampaikan beberapa hal sebagai berikut: 1. Dinas Pendidikan dan Kebudayaan Kota Magelang sudah melakukan pembinaan kepada guru ybs secara langsung dihadapan warga sekolah, pada kesempatan tersebut kami berikan penjelasan dan pemahaman tentang PP 53 tahun 2010 tentang disiplin PNS. 2. Kesepakatan dan kesepahaman yang diperoleh pada pertemuan tersebut adalah a. Guru yang bersangkutan menyadari kesalahan yang dilakukan dan berjanji akan melaksanakan tugas dan kewajiban sebagai seorang guru. b. Kepala Sekolah menyatakan memahami kewajiban secara administratif sebagai pembina kepegawaian di satuan pendidikan sebagaimana diamanatkan dalam PP 53 tahun 2010 ttg disiplin PNS. 3. Bidang Pembinaan Guru dan Tenaga Kependidikan sudah beberapa kali memanggil guru yang bersangkutan untuk melakukan pembinaan. 4. Terkait tindakan sanksi administratif yang belum dikeluarkan oleh Dinas Pendidikan dan Kebudayaan Kota Magelang disebabkan belum adanya laporan tertulis dan permohonan pemberian sanksi kepada guru ybs dari kepala sekolah yang disertai dengan berkas administratifnya. Demikian penjelasan kami."
28 Mar 2021,https://laporgub.jatengprov.go.id/detail/LGWA75162627.html,KOTA MAGELANG,"Alamat: Kabupaten Magelang, Kecamatan Magelang utara, Kelurahan kelurahan wates Laporan: keluhan: maaf bapak mau bertanya terkait studi budaua atau studi wisata bagi siswa, apakah dimasa pandemi seperti ini sekolah sekolah sudah diijinkan untuk mengadakan studi wisata /studi budaya dengan siswa yang banyak, Terima kasih",Selesai,"Kamis, 15 April 2021 - 07:57 WIB",Kota Magelang,Dinas Pendidikan dan Kebudayaan Kota Magelang tidak memberikan Ijin kepada Sekolah untuk melaksanakan StudyTour pada masa pandemi
01 Apr 2021,https://laporgub.jatengprov.go.id/detail/LGWP39350448.html,KOTA MAGELANG,"Yang terhormat Pak Gubernur, Saya warga Botton. Kota Magelang, Kec. Magelang Tengah. Saya ingin membuat pengaduan untuk bantuan BANSOS di tempat saya yang kurang tepat sasaran dan janggal. Dikarenakan, keluarga Saya yang sempat mendapat bansos covid pada bulan mei-juli 2020, kemudian tidak mendapatkan lagi dibulan agustus hingga bulan dan tahun ini. Awalnya RT kami yang mendapat bansos covid 8 Kepala Keluarga, namun bulan agustus keluarga kami tidak mendapatkan bansos. keluarga kami kaget dan bingung dimana salah satu warga RW kami ada yang memiliki properti berupa mobil dan tempat kos-kosan namun masih mendapatkan bansos. Kami sempat ke kantor kelurahan magelang tengah dan data keluarga kami tidak ditemukan padahal sudah didafttarkan oleh RW setempat. Saya tidak tahu kriteria apa untuk mendapat bansos covid-19. Saya jabarkan Keluarga saya yang terdiri dari 3orang. Dimana Keluarga kami terdiri dari Ibu saya janda tidak berpenghasilan, Saya yang diPhk maret 2020 dan belum mendapat kerja kembali bahkan tidak lolos prakerja berkali-kali, Adik saya bungsu kerja sebagai spg toko dengan gaji setengah, Bahkan rumah yang kami tempati adalah ""numpang"". Apakah keluarga kami yang kurang mampu termasuk yang tidak mendpatkan bansos?? Mohon kejelasannya. Mohon maaf bila ada salah kata dan Terima kasih.",Selesai,"Kamis, 01 April 2021 - 15:25 WIB",Kota Magelang,"1. Terima kasih atas laporan Bapak, kami sampaikan bahwa mekanisme penyaluran BST yang bersumber dari APBN sudah dirumuskan sesuai mekanisme dan peraturan yang berlalu 2. Selanjutnya terkait penyaluran bahwa data bayar sesuai dengan data bayar yang diterima PT.Pos dari Kementerian Sosial 3. Silahkan berkonsultasi dan koordinasi dengan kelurahan setempat terkait Data Terpadu Kesejahteraan Sosial (DTKS) sekiranya keluarga belum terdaftar dalam DTKS dapat secara mandiri mendaftarkan mekanisme DTKS melalui kelurahan setempat 4. Demikian terima kasih"
04 Apr 2021,https://laporgub.jatengprov.go.id/detail/LGWP13459846.html,KOTA MAGELANG,"Selamat siang bapak gubernur dan bapak wagib. Salam hormat. Saya dokter umum di magelang alumni gadjahmada. Saya ingin sekali melanjutkan sekolah spesialis demi untuk melanjutkn perjuangan meningkatkn kesehatan bangsa ini. Mohon dengan sangat berikan saya rekomendasi pak ???? Mengingat sulitnya sekarang untuk melanjutkan ke sekolah spesialisasi Berikut saya lampirkan. Dan saya sudah minta rekomendasi dari direktur RS saya Ditolak, ke walikotapun ditolak. Mohon bantuannya pak. Maaf ats kelancangan saya . Terimaksih",Selesai,"Senin, 19 April 2021 - 08:04 WIB",Kota Magelang,"Terima kasih atas laporannya, berikut kami sampaikan tanggapan dari RSUD Tidar : Penjelasan resmi RSUD Tidar atas berita dr. M. HERDHANA ASH SHIDIQI (dr. MHAS) : Bahwa dr. MHAS sampai dengan saat ini masih berstatus Dokter Umum Mitra / Dokter Tamu RSUD Tidar. Sesuai dg Peraturan Direktur No 1/PER/RSUDT/II/2021: surat ijin rekomendasi sekolah spesialis diberikan kepada dokter PNS/ BLUD Rsud tidar. Hal tersebut sudah disampaikan kepada semua DOKTER UMUM termasuk ybs untuk pelaksanaan kerja sama tahun 2021, tetapi ybs menolak sebagai dokter BLUD dan memilih tetap sebagai Dokter Umum Mitra/ dokter tamu. Supaya tidak menimbulkan kesimpangsiuran berita dan ketidakjelasan, maka diharap informasi ini dapat melengkapi berita yang disampaikan oleh dr. MHAS di ""Monggo Lapor"" Terima kasih"
15 Apr 2021,https://laporgub.jatengprov.go.id/detail/LGWP17243037.html,KOTA MAGELANG,Terkait dana Pip anak sekolah kenapa anak saya cuma turun 1x ya pak gubernur.mohon Bantuanya pak trimakasih,Belum Diproses,Belum Diproses,Belum Diproses,Belum Diproses
17 Apr 2021,https://laporgub.jatengprov.go.id/detail/LGWP95890582.html,KOTA MAGELANG,Maaf terkait bantuan yang terdampak covid.saya belum dapat bantuan apa pun mohon bantuannya pak?,Belum Diproses,Belum Diproses,Belum Diproses,Belum Diproses
21 Apr 2021,https://laporgub.jatengprov.go.id/detail/LGAN72365052.html,KOTA MAGELANG,alasan pengurangan penerimaan BST blm Maret & April 2021 karena petugas terkait TDK bisa memberikan penjelasan ke masyarakat yg gamblang.supaya tdk terjadi tanda tanya.suwun,Selesai,"Minggu, 25 April 2021 - 03:01 WIB",Kota Magelang,"Terima kasih atas laporan sdr Kennedy Louren, berikut kami sampaikan informasi sebagai terkait bansos: 1. Bantuan sosial terdapat beberapa ragam bantuan sosial sesuai dengan bidang bantuan sosial baik yang bersumber dari APBD, APBN melalui kementerian/lembaga. 2. Ketepatan sasaran penerima bantuan sosial tergantung : a. Usulan RT/RW/Kelurahan melalui musyawarah kelurahan. b. Sesuai Data Terpadu Kesejahtehteraan Sosial (DTKS) yang diterbitkan Kementerian Sosial. 3. Sekiranya keluarga belum terdaftar dalam DTKS secara mandiri dapat berkonsultasi dan koordinasi dengan petugas operator DTKS di kelurahan setempat. 4. alasan pengurangan penerima Bansos diantaranya data ganda dalam 1 keluarga, ganda identik, ganda tidak identik, KKS tidak terdistribusi, non aktif finalisasi DTKS, feedback BPJS, feedback BST, feedback Dukcapil, PKH graduasi, dan tidak melakukan transaksi. Demikian terima kasih."
24 Apr 2021,https://laporgub.jatengprov.go.id/detail/LGWA66611064.html,KOTA MAGELANG,"Alamat: Kabupaten Kota Magelang, Kecamatan Kecamatan Magelang Utara, Kelurahan Kelurahan Potrobangsan Laporan: Mohon bantuan melakukan review atau inspeksi kinerja petugas PNPM wilayah kota Magelang khususnya kelurahan Potrobangsan. Proses pencairan dana pinjaman lama dan berbelit-belit kami hanya dijanji- janjikan tapi tak kunjung cair. Kami sebagai nasabah lama merasa dibuang dari kelompok sebelumnya dan dimasukkan ke kelompok yang bermasalah sehingga tidak kunjung cair padahal sebelumnya kami sangat tertib dalam pembayaran. Nama ibu saya pun dicoret hilang tanpa alasan dari kelompok padahal ada surat ijin usaha resmi, pembayaran tertib dan merupakan anggota lama. Sedangkan ada yang tidak punya usaha dan pembayaran selalu terlambat malah sudah cair. Saya khawatir ada kecurangan atau sistem yang tidak jujur karena saya sempat difitnah pembayaran tidak tertib padahal sebaliknya. Yang tidak tertib malah sudah cair duluan. Mohon bantuannya bapak kami sebagai rakyat kecil merasa dipermainkan. Terimakasih dan mohon maaf atas curahan hati kami",Selesai,"Kamis, 29 April 2021 - 13:47 WIB",Kota Magelang,"Terima kasih mba Dian Kusumaningrum Mohon maaf sebelumnya, apakah sdh ada komunikasi dengan Faskel Pendamping PNPM nya ?? Jika belum,Mohon dikomunikasikan dulu dengan Faskel pendamping mba.. Pendamping PNPM wilayah kel. Potrobangsan bisa menghubungi mbak Tari di nomor HP 0813 2536 3556.. Memang ada penundaan untuk proses pencairan karena ada masalah intern.. Monggo dukomunikasikan dengan pendamping nggih Mba Dian.. Terima kasihh"
27 Apr 2021,https://laporgub.jatengprov.go.id/detail/LGWP59907348.html,KOTA MAGELANG,"selamat sore bapak gubernur ganjar,, assalamualaikum wr.wb.. jadi begini pak ganjar, nuwun sewu sakderenge, niki kulo bagas pak, GTT SMA N 5 Magelang, ajeng tanglet, niki gaji GTT PTT kog dereng mandap nggih, wulan april niki pak, pripun niki pak ? kalih khusus GTT PTT onten THR mboten nggih pak? Honor Telat + mboten onten THR lak nggih ngenes to pak kulo lan rencang2..â˜¹â˜¹ nyuwun pencerahanipun Pak Gubernur.",Belum Diproses,Belum Diproses,Belum Diproses,Belum Diproses
09 May 2021,https://laporgub.jatengprov.go.id/detail/LGWA20925947.html,KOTA MAGELANG,"Alamat: Kabupaten Kabupatenmagelang, Kecamatan KecamatanMungkid, Kelurahan KelurahanPabelan Laporan: Laporankeluhan,assalamualaikum wr wb dngn tdk mngurangi rs hormat sy mau mlporkan bahwa kami 20anggota satpol PP kota Magelang tlh di PHK sepihak tnpa kami tau kslhn yg kami lakukan,PHK trsebut hanya lwt srt yg di kirim ke rmh bhkn ada yg di klrhn dan RW pdhl wkt itu kami msh brtgs.srt PHK trsebut di kirim tgl 30 April 2021 dan tgl 1mei 2021 kami sdh di hentikan pdhl dlm kontrak tertulis 12bln dan bila ada kslhn dlm kontrak jg tertulis ada teguran dsb tp kami tak prnh dpt teguran ataupun SP.Pdhl bln romadhon mnjlng lebaran dan pandemi tp kami khlngn rejeki,sdngkn sy bth biaya untk membsrkn ank. Kami anggota satpol PP kota Magelang mhn bantuan dari BPK gubernur, ats prhtianya kami ucapkan trmksh dan mhn maaf bila ada kata yg kurang berkenan.",Selesai,"Minggu, 16 Mei 2021 - 21:02 WIB",Kota Magelang,"Untuk mempercepat terwujudnya Kota Magelang yang lebih baik, maka beberapa kebijakan yang membawa arah perubahan dalam pembangunan pada periode jabatan kepemimpinannya harus segera dilaksanakan, termasuk mengambil kebijakan yang kurang populis. Walikota memang memberikan kebijakan, agar THL ini dilakukan evaluasi. Terjemahan kebijakan tersebut ia serahkan sepenuhnya kepada Sekda, yang ditindaklanjuti oleh Kepala OPD. Namun demikian, Wali Kota memastikan bahwa sebelum rasionalisasi dilakukan, ada prosesnya termasuk evaluasi kinerja. Semua sudah dikaji. OPD yang memberikan datanya, karena sudah melakukan evaluasi dan seleksi. Wali Kota menegaskan ingin penyelenggaraan pemerintahan diarahkan untuk mempercepat terwujudnya kesejahteraan masyarakat, terutama melalui peningkatan pelayanan, pemberdayaan dan peran serta masyarakat, serta meningkatkan daya saing daerah. Sekretaris Daerah (Sekda) Kota Magelang Joko Budiyono menjelaskan THL ini bisa disebut juga sebagai penyedia jasa perorangan, yang upahnya berasal dari pos belanja jasa pada kegiatan masing-masing OPD sehingga status mereka bukan pegawai. Oleh karenanya, apabila kebijakan Bapak Wali Kota adalah untuk mengevaluasi THL selaku penyedia jasa, maka secara normatif hal ini bisa dilakukan. Selain itu, Wali Kota adalah kepala pemerintahan yang juga menjadi pemegang kekuasaan pengelolaan APBD, sehingga bisa menetapkan kebijakan terkait pelaksanaan APBD. Jadi apabila Wali Kota menginginkan evaluasi terhadap penyedia jasa, maka hal itu menjadi hak prerogatifnya Joko melanjutkan, rasionalisasi terhadap sejumlah THL ini dilakukan dalam beberapa langkah evaluasi. Evaluasi yang pertama adalah mendata THL yang berusia diatas 58 tahun, karena sama saja telah memasuki usia pensiun. Kemudian yang berikutnya adalah evaluasi kinerja. Mana THL yang bekerja tidak disiplin, dan mana THL yang bekerja seenaknya sendiri, maka hal itu menjadi pertimbangan untuk dilakukan rasionalisasi."
10 May 2021,https://laporgub.jatengprov.go.id/detail/LGWA45088873.html,KOTA MAGELANG,"Alamat: Kabupaten Kotamagelang, Kecamatan KecamatanMagelang selatan, Kelurahan KelurahanRejowinangun Laporan: Laporankeluhan,assalamualaikum wr wb dengan tidak mengurangi rasa hormat saya mau menyampaiakan melaporkan bahwa kami 20 Anggota THL ( Tenaga Harian Lepas ) Satpol PP kota Magelang telah di PHK secara sepihak tanpa kami tau sebab dan kesalahan yang kami lakukan, PHK trsebut hanya lewat surat yang di kirim ke rumah bahkan ada yang di kelurahan dan RW padahal waktu itu kami masih bertugas, Surat PHK trsebut di kirim tgl 30 April 2021 dan tgl 1mei 2021 kami sudah di hentikan padahal dalam kontrak tertulis 12bln dan bila ada kslhn dlm kontrak juga tertulis ada teguran tetapi kami tidak pernah dapat teguran ataupun surat peringatan/SP. bln romadhon mnjlng lebaran dan pandemi tetapi kami kehilangan rejeki, sedangkan saya bth biaya untuk kebutuhan setiap hari Kami anggota satpol PP kota Magelang mhn bantuan dari Bapak Gubernur, ats prhtianya kami ucapkan trmksh dan mohon maaf bila ada kata yg kurang berkenan. Kami lampirkan 1. Surat pemberhentian 2. Surat perjanjian Kontrak Kerja",Selesai,"Minggu, 16 Mei 2021 - 21:02 WIB",Kota Magelang,"Untuk mempercepat terwujudnya Kota Magelang yang lebih baik, maka beberapa kebijakan yang membawa arah perubahan dalam pembangunan pada periode jabatan kepemimpinannya harus segera dilaksanakan, termasuk mengambil kebijakan yang kurang populis. Walikota memang memberikan kebijakan, agar THL ini dilakukan evaluasi. Terjemahan kebijakan tersebut ia serahkan sepenuhnya kepada Sekda, yang ditindaklanjuti oleh Kepala OPD. Namun demikian, Wali Kota memastikan bahwa sebelum rasionalisasi dilakukan, ada prosesnya termasuk evaluasi kinerja. Semua sudah dikaji. OPD yang memberikan datanya, karena sudah melakukan evaluasi dan seleksi. Wali Kota menegaskan ingin penyelenggaraan pemerintahan diarahkan untuk mempercepat terwujudnya kesejahteraan masyarakat, terutama melalui peningkatan pelayanan, pemberdayaan dan peran serta masyarakat, serta meningkatkan daya saing daerah. Sekretaris Daerah (Sekda) Kota Magelang Joko Budiyono menjelaskan THL ini bisa disebut juga sebagai penyedia jasa perorangan, yang upahnya berasal dari pos belanja jasa pada kegiatan masing-masing OPD sehingga status mereka bukan pegawai. Oleh karenanya, apabila kebijakan Bapak Wali Kota adalah untuk mengevaluasi THL selaku penyedia jasa, maka secara normatif hal ini bisa dilakukan. Selain itu, Wali Kota adalah kepala pemerintahan yang juga menjadi pemegang kekuasaan pengelolaan APBD, sehingga bisa menetapkan kebijakan terkait pelaksanaan APBD. Jadi apabila Wali Kota menginginkan evaluasi terhadap penyedia jasa, maka hal itu menjadi hak prerogatifnya Joko melanjutkan, rasionalisasi terhadap sejumlah THL ini dilakukan dalam beberapa langkah evaluasi. Evaluasi yang pertama adalah mendata THL yang berusia diatas 58 tahun, karena sama saja telah memasuki usia pensiun. Kemudian yang berikutnya adalah evaluasi kinerja. Mana THL yang bekerja tidak disiplin, dan mana THL yang bekerja seenaknya sendiri, maka hal itu menjadi pertimbangan untuk dilakukan rasionalisasi."
11 May 2021,https://laporgub.jatengprov.go.id/detail/LGIG47713843.html,KOTA MAGELANG,"Pak Ganjar mhn maaf ijin bertanya, pipa air pdam di rumah saya patah akibat tanah belakang rumah amblong krn erosi air sungai; yg mengakibatkan tagihan air melonjak sangat tinggi dikarenakan kebocoran tsb. Shg pemakaian air yg rata2 sekitar 30 kubik per bulan menjadi 130 an lebih . Apakah diperkenankan saya mengjukan keringanan pembayaran krn kejadian tsb tjd krn force major? Mhn solusinnya Bapak. Terima kasih. Saya tinggal di kampung Malangan Kel Tidar Utara Kota Magelang.????????",Selesai,"Minggu, 16 Mei 2021 - 21:03 WIB",Kota Magelang,sudah ditindaklanjuti. terimakasih
13 May 2021,https://laporgub.jatengprov.go.id/detail/LGWA31635277.html,KOTA MAGELANG,"Alamat: Kabupaten Kota Magelang, Kecamatan Kecamatan Magelang Selatan, Kelurahan Kelurahan Tidar Utara Laporan: Selamat pagi pak, mohon maaf mengganggu. Izin memperkenalkan diri, nama saya Hammada Pranaja Katili, salah satu siswa kelas 10 dari SMA Taruna Nusantara. Izin sebelumnya pak, saya sebagai siswa kelas 10 diberikan tugas oleh pamong (guru) mapel Bahasa Indonesia untuk mewawancarai salah satu pejabat di daerah masing-masing. Terkait dengan hal tersebut, dengan segala kerendahan hati, apakah Bapak berkenan menerima saya dan beberapa rekan siswa untuk wawancara? Terimakasih banyak Pak sebelumnya. Selamat pagi????????",Selesai,"Senin, 17 Mei 2021 - 10:13 WIB",BIRO UMUM,"Berdasarkan konfirmasi yang disampaikan oleh Pelapor via hotline center PPID Pembantu Setda, aduan yang disampaikan ini dibatalkan oleh Pelapor."
14 May 2021,https://laporgub.jatengprov.go.id/detail/LGAN09947639.html,KOTA MAGELANG,"Tinjau Ulang Tata Kelola Sampah dari Hulu ke Hilir Beberapa waktu belakangan ini saya melihat banyak sekali sampah berserakan di penjuru kota. Mulai dari pinggir kebun/lahan kosong, di trotoar, hingga di kali/sungai. Foto yang saya sertakan dalam laporan ini adalah Kali Bening di Karet, Magelang Selatan. Dimohon dengan sangat untuk Dinas Lingkungan Hidup untuk mengevaluasi sistem pengangkutan sampah dari hulu ke hilir. Karena menurut UU No. 18/2008 tentang Pengelolaan Sampah, Produsen wajib bertanggung-jawab atas kemasan produk mereka. Pemerintah pun diwajibkan memiliki sistem pengelolaan sampah yang andal, maka bisa saja Pemkot mengupgrade kapasitas dan kapabilitas TPA Banyuurip dengan meminta produsen produk FMCG (Fast Moving Consumer Goods) untuk ikut berkontribusi dalam pengembangan lanjut TPA tersebut. Sistem pengelolaan sampah harus andal dari hulu ke hilir, mulai edukasi masyarakat, pengangkutan residu, hingga pengelolaan akhir di TPA.",Selesai,"Rabu, 19 Mei 2021 - 15:55 WIB",Kota Magelang,"Slamt sore mbk menindaklabjuti lapor gub dari psda sebisa mungkin membersihkan sampah dilokasi mbk namun demikian untuk adany sampah yang berada ataupun dibuang ke saluran dari kami sudah sering mengigatkan baik berupa teguran maupun papan larangan namun demikian faktor kesadaran lingkungan setempat yang sejauh ini masih kurang,"
27 May 2021,https://laporgub.jatengprov.go.id/detail/LGWP18201506.html,KOTA MAGELANG,"Saya Rian Ramadhan mahasiswa Universitas Pendidikan Ganesha, Bali. Saya ingin complain mengenai kebijakan yang diterapkan di Kab. Magelang mengenai kegiatan KKNbD (daring) yang rencana saya ambil di Kec. tegalrejo, Kab. Magelang. Pak saya warga Kota Magelang, akan tetapi saat saya mendatangi kantor kepala desa Ngasem untuk menyerahkan surat tugas saya untuk KKNbD Mandiri malah dilempar ke Kecamatan Tegalrejo, saya pun kemudian kesana, tetapi respon kecamatan Tegalrejo suruh meminta izin ke Kantor perizinan di Kota Mungkid yang jaraknya jauh sekali, saya diterima dgn baik dan dilempar ke Kesbangpol. Di kesbangpol lagi-lagi saya ditolak dengan alasan tidak ada surat khusus yang ditujukan ke Kesbangpol, disana saya harus melampirkannya dan harus ada persetujuan dari bupati. Seribet itu kah pak untuk mengembangkan diri melalui KKN, padahal saya cuma dapat surat perintah dari kampus untuk ke kepala dusun/desa/rt/rw. Lha ini malah berujung ribet. Saya juga warga Jawa Tengah asli Pak. Mohon kebijakannya dalam hal ini. ????",Selesai,"Kamis, 17 Juni 2021 - 13:57 WIB",Kabupaten Magelang,"Alur persyaratan ijin melaksakana kegiatan KKN (di masa pandemi) Badan Kesbangpol akan mengeluarkan Surat Rekomendasi yang dilengkapi dengan syarat : 1. Surat pengantar dari Kampus yang ditujukan kepada Bupati Magelang cq Kepala Kesbangpol, 2. Fc KTP peserta dan Penanggung Jawab, 3. Surat Keterangan dan Kesediaan dari Kades wilayah/Lokasi yang dituju sebagai ytempat KKN dan diketahui oleh Camat Setempat Apabila persyaratan tersebut tidak dilengkapi oleh pemohon maka rekomendasi untuk KKN tidak bisa diterbitkan. terimakasih"
22 May 2021,https://laporgub.jatengprov.go.id/detail/LGTW10832018.html,KOTA MAGELANG,"Ijin bertanya, Taekwondo Jateng akan mengadakan UKT tgl 5/6 juni 2021 di Rindam Magelang, potensi yang datang tiap kabupaten kemungkinan diatas 50 peserta dan menginap, pertanyaan saya apakah kegiatan ini diijinkan, sedangkan untuk seleksi Popnas saja di tangguhkan",Selesai,"Sabtu, 29 Mei 2021 - 07:30 WIB",Kota Magelang,1. Tahapan Simulasi dgn tim gugus tugas covid sdh dilaksanakan di Gedung Guntur Geni Armed 11 Rindam 4 Diponegoro 2. Rekomendasi sdh ada ditandatangani Plt. Kadisporapar 3. Pakta Integritas beserta lampirannya bermaterai sdh ditandatangani oleh Ketua Panitia/Penyelenggara 4.UKT Taekwondo tdk berkaitan langsung dgn Penyelenggaraan POPNAS
29 May 2021,https://laporgub.jatengprov.go.id/detail/LGWP13498669.html,KOTA MAGELANG,"Selamat Siang Pak Ganjar.. Semoga semoga sehat selalu serta dilancarkan segala urusanya.. Aamiin.. Mau menanyakan perihal kepengursan pemecahan sertipikat tanah di BPN Kota Magelang.. saya buta dalam hal itu, tapi saya melihat beberapa pernyataan di web lama kepengurusan sertipikat tanah adalah 15 hari kerja setelah berkas masuk tanpa ada kekurangan.. Jika 1 minggu adalah 5 hari kerja berarti 3 minggu adalah 15 hari kerja, tetapi yang saya alami kok sudah 2 bulan lebih semenjak saya memasukan berkas belum selesai ya. mohon pencerahanya..",Selesai,"Senin, 13 Desember 2021 - 23:38 WIB",Kanwil BPN Provinsi Jawa Tengah,silahkan sodara kirim kuitansi dari BPN akan mudah dalam kami melacaknya terimakasih
31 May 2021,https://laporgub.jatengprov.go.id/detail/LGWP52295776.html,KOTA MAGELANG,"Selamat siang bapak ganjar terhormat salam santun, saya mau bertanya saya sudah lama merantau ke Bali KTP saya masih magelang dan sekarang saya kena dampak covid dan pekerjaan saya hilang.apakah pemerintah jawa tengah menggelontorkan dana bantuan?",Belum Diproses,Belum Diproses,Belum Diproses,Belum Diproses
01 Jun 2021,https://laporgub.jatengprov.go.id/detail/LGWP94898743.html,KOTA MAGELANG,saya tki malaysia sya ingin melaporkan penipuan oknum pekanbaru dgn jual beli mobil onlin sya asli dari magelang jawa tengah sya meminta bantuan sama gub ganjar pranowo untuk salah sya ini terimakasih,Selesai,"Rabu, 02 Juni 2021 - 13:49 WIB",Kepolisian Daerah Jawa Tengah,Pengadu disarakan untuk melaporkan peristiwanya ke Kepolisian terdekat dengan membawa bukti-bukti yang dimiliki
